menu_type,alternativ,datum,vecka,veckodag,ratt,ratt_orig,energi_kcal,protein_g,fett_g,kolhydrater_g,kostfibrer_g,salt_g,vikt_g
ao,Timbal alt 1,2025-02-04,6,Tisdag,"Stekt strömming timbal med potatismos, skirat smör och ärtor","Stekt strömming timbal med potatismos, skirat smör och ärtor",746.94,24.75,60.77,25.6,3.31,1.74,384.55
ao,Timbal alt 2,2025-02-04,6,Tisdag,Gulaschsoppa timbal,Gulaschsoppa timbal,232.79,12.64,15.6,10.16,1.16,,320.0
ao,A-kost alt 1,2025-02-05,6,Onsdag,"Kassler med svampsås, stekt potatis* och grönsaker","Kassler med svampsås, stekt potatis* och grönsaker",261.87,28.11,10.11,13.09,2.71,4.99,315.23
ao,A-kost alt 2,2025-02-05,6,Onsdag,"Stekt prinskorv, stuvad spenat, stekt potatis*","Stekt prinskorv, stuvad spenat, stekt potatis*",285.97,13.02,19.76,13.67,1.49,5.31,300.59
ao,Grov Paté alt 1,2025-02-05,6,Onsdag,"Kassler paté med svampsås, stekt potatis* och grönsaker","Kassler paté med svampsås, stekt potatis* och grönsaker",297.73,16.21,17.51,17.79,2.87,1.75,295.23
ao,Grov Paté alt 2,2025-02-05,6,Onsdag,"Stekt prinskorv, stuvad spenat, stekt potatis*","Stekt prinskorv, stuvad spenat, stekt potatis*",285.97,13.02,19.76,13.67,1.49,5.31,300.59
ao,Timbal alt 1,2025-02-05,6,Onsdag,"Kassler timbal med svampsås, stekt potatis och grönsaker","Kassler timbal med svampsås, stekt potatis och grönsaker",543.8,25.06,26.77,49.63,4.79,1.9,515.03
ao,Timbal alt 2,2025-02-05,6,Onsdag,Korvtimbal med brynt potatis och stuvad spenat slät,Korvtimbal med brynt potatis och stuvad spenat slät,447.35,20.42,19.71,44.45,4.89,4.83,515.39
ao,A-kost alt 1,2025-02-06,6,Torsdag,Ärtsoppa med fläsk ÄO,Ärtsoppa med fläsk ÄO,273.85,24.5,2.41,33.14,9.74,2.0,308.0
ao,A-kost alt 2,2025-02-06,6,Torsdag,"Stekt prinskorv, stuvad spenat, stekt potatis*","Stekt prinskorv, stuvad spenat, stekt potatis*",285.97,13.02,19.76,13.67,1.49,5.31,300.59
ao,Grov Paté alt 1,2025-02-06,6,Torsdag,Ärtsoppa med fläskpaté ÄO,Ärtsoppa med fläskpaté ÄO,219.71,14.45,0.91,33.14,9.74,0.5,308.0
ao,Grov Paté alt 2,2025-02-06,6,Torsdag,"Stekt prinskorv, stuvad spenat, stekt potatis*","Stekt prinskorv, stuvad spenat, stekt potatis*",285.97,13.02,19.76,13.67,1.49,5.31,300.59
ao,Timbal alt 1,2025-02-06,6,Torsdag,Ärtsoppa slät med fläsktimbal  ÄO,Ärtsoppa slät med fläsktimbal  ÄO,322.49,20.45,7.91,36.89,9.74,1.01,308.0
ao,Timbal alt 2,2025-02-06,6,Torsdag,Stekt korvtimbal med stuvad spenat slät och potatismos,Stekt korvtimbal med stuvad spenat slät och potatismos,388.35,18.19,15.91,40.85,4.1,5.05,505.84
ao,A-kost alt 1,2025-02-07,6,Fredag,Pannbiff med råstekt potatis* grönpepparsås och grönsaker,Pannbiff med råstekt potatis* grönpepparsås och grönsaker,464.47,26.14,31.32,18.59,2.96,3.35,338.55
ao,A-kost alt 2,2025-02-07,6,Fredag,"Fläskköttgryta med apelsin, kokt potatis* och grönsaker","Fläskköttgryta med apelsin, kokt potatis* och grönsaker",326.29,29.04,15.17,16.32,4.05,2.87,348.9
ao,Grov Paté alt 1,2025-02-07,6,Fredag,Pannbiff med råstekt potatis* grönpepparsås och grönsaker,Pannbiff med råstekt potatis* grönpepparsås och grönsaker,464.47,26.14,31.32,18.59,2.96,3.35,338.55
ao,Grov Paté alt 2,2025-02-07,6,Fredag,"Fläskköttgryta med apelsin paté, kokt potatis* och grönsaker","Fläskköttgryta med apelsin paté, kokt potatis* och grönsaker",352.96,19.08,19.13,24.12,4.29,4.07,348.9
ao,Timbal alt 1,2025-02-07,6,Fredag,"Färstimbal, grönpepparsås, stekt potatis, grönsaker","Färstimbal, grönpepparsås, stekt potatis, grönsaker",385.5,11.6,19.99,38.05,4.16,1.81,461.71
ao,Timbal alt 2,2025-02-07,6,Fredag,"Fläskköttgryta med apelsin timbal , solskensmos och grönsaker","Fläskköttgryta med apelsin timbal , solskensmos och grönsaker",666.6,28.52,32.98,60.08,8.85,4.94,593.9
ao,A-kost alt 1,2025-02-08,6,Lördag,"Panerad fiskfilé med kall örtstsås, potatis* och grönsaker","Panerad fiskfilé med kall örtstsås, potatis* och grönsaker",594.56,28.61,41.74,24.49,4.98,1.42,343.91
ao,A-kost alt 2,2025-02-08,6,Lördag,"Fläskköttgryta med apelsin, kokt potatis* och grönsaker","Fläskköttgryta med apelsin, kokt potatis* och grönsaker",326.29,29.04,15.17,16.32,4.05,2.87,348.9
ao,Grov Paté alt 1,2025-02-08,6,Lördag,"Panerad fiskfilé med kall örtstsås, potatis* och grönsaker","Panerad fiskfilé med kall örtstsås, potatis* och grönsaker",594.56,28.61,41.74,24.49,4.98,1.42,343.91
ao,Grov Paté alt 2,2025-02-08,6,Lördag,"Fläskköttgryta med apelsin paté, kokt potatis* och grönsaker","Fläskköttgryta med apelsin paté, kokt potatis* och grönsaker",352.96,19.08,19.13,24.12,4.29,4.07,348.9
ao,Timbal alt 1,2025-02-08,6,Lördag,"Panerad fisktimbal, örtsås slät, potatismos och grönsaker","Panerad fisktimbal, örtsås slät, potatismos och grönsaker",490.83,8.51,35.12,34.65,3.13,2.83,338.85
ao,Timbal alt 2,2025-02-08,6,Lördag,"Fläskköttgryta med apelsin timbal , solskensmos och grönsaker","Fläskköttgryta med apelsin timbal , solskensmos och grönsaker",666.6,28.52,32.98,60.08,8.85,4.94,593.9
ao,A-kost alt 1,2025-02-09,6,Söndag,"Stekt kycklingfilé med gräddsås, potatis* och grönsaker","Stekt kycklingfilé med gräddsås, potatis* och grönsaker",340.13,30.72,19.09,10.39,2.28,3.36,294.55
ao,A-kost alt 2,2025-02-09,6,Söndag,"Fläskköttgryta med apelsin, kokt potatis* och grönsaker","Fläskköttgryta med apelsin, kokt potatis* och grönsaker",326.29,29.04,15.17,16.32,4.05,2.87,348.9
ao,Grov Paté alt 1,2025-02-09,6,Söndag,"Stekt kycklingpaté med gräddsås, potatis* och grönsaker","Stekt kycklingpaté med gräddsås, potatis* och grönsaker",324.92,16.37,22.78,12.78,2.51,3.54,285.3
ao,Grov Paté alt 2,2025-02-09,6,Söndag,"Fläskköttgryta med apelsin paté, kokt potatis* och grönsaker","Fläskköttgryta med apelsin paté, kokt potatis* och grönsaker",352.96,19.08,19.13,24.12,4.29,4.07,348.9
ao,Timbal alt 1,2025-02-09,6,Söndag,"Stekt kycklingtimbal med gräddsås, potatisgratäng och grönsaker","Stekt kycklingtimbal med gräddsås, potatisgratäng och grönsaker",662.66,24.0,40.12,50.01,4.35,2.54,572.7
ao,Timbal alt 2,2025-02-09,6,Söndag,"Fläskköttgryta med apelsin timbal , solskensmos och grönsaker","Fläskköttgryta med apelsin timbal , solskensmos och grönsaker",666.6,28.52,32.98,60.08,8.85,4.94,593.9
ao,A-kost alt 1,2025-02-10,7,Måndag,"Korvgryta med dill och pepparrot, potatis* och kokta grönsaker","Korvgryta med dill och pepparrot, potatis* och kokta grönsaker",396.73,12.57,31.78,14.13,3.79,1.88,283.77
ao,A-kost alt 2,2025-02-10,7,Måndag,"Gräddstuvad pyttipanna, stekt ägg","Gräddstuvad pyttipanna, stekt ägg",757.75,19.03,47.74,60.0,7.25,4.27,356.0
ao,Grov Paté alt 1,2025-02-10,7,Måndag,"Korvgryta med dill och pepparrot, potatis* och kokta grönsaker","Korvgryta med dill och pepparrot, potatis* och kokta grönsaker",396.73,12.57,31.78,14.13,3.79,1.88,283.77
ao,Grov Paté alt 2,2025-02-10,7,Måndag,"Gräddstuvad pytt i panna paté, stekt ägg","Gräddstuvad pytt i panna paté, stekt ägg",757.75,19.03,47.74,60.0,7.25,4.27,356.0
ao,Timbal alt 1,2025-02-10,7,Måndag,"Korvgryta med dill och pepparrot timbal, potatismos och grönsakstimbal","Korvgryta med dill och pepparrot timbal, potatismos och grönsakstimbal",345.75,14.86,15.74,34.65,3.41,1.44,519.25
ao,Timbal alt 2,2025-02-10,7,Måndag,"Pytt Bellman timbal med äggkräm, rödbetsgelé","Pytt Bellman timbal med äggkräm, rödbetsgelé",907.65,34.5,64.61,62.07,5.27,3.45,812.6
ao,A-kost alt 1,2025-02-11,7,Tisdag,"Fiskfärsbiff med romsås, potatis* samt grönsaker","Fiskfärsbiff med romsås, potatis* samt grönsaker",764.5,18.45,58.99,39.4,4.19,2.55,295.71
ao,A-kost alt 2,2025-02-11,7,Tisdag,"Gräddstuvad pyttipanna, stekt ägg","Gräddstuvad pyttipanna, stekt ägg",757.75,19.03,47.74,60.0,7.25,4.27,356.0
ao,Grov Paté alt 1,2025-02-11,7,Tisdag,"Fiskfärsbiff med romsås, potatis* samt grönsaker","Fiskfärsbiff med romsås, potatis* samt grönsaker",764.5,18.45,58.99,39.4,4.19,2.55,295.71
ao,Grov Paté alt 2,2025-02-11,7,Tisdag,"Gräddstuvad pytt i panna paté, stekt ägg","Gräddstuvad pytt i panna paté, stekt ägg",757.75,19.03,47.74,60.0,7.25,4.27,356.0
ao,Timbal alt 1,2025-02-11,7,Tisdag,"Panerad torsktimbal med romsås, potatis/palsternacksmos samt grönsakstimbal","Panerad torsktimbal med romsås, potatis/palsternacksmos samt grönsakstimbal",876.59,21.28,66.7,48.31,7.52,2.32,475.58
ao,Timbal alt 2,2025-02-11,7,Tisdag,"Pytt Bellman timbal med äggkräm, rödbetsgelé","Pytt Bellman timbal med äggkräm, rödbetsgelé",907.65,34.5,64.61,62.07,5.27,3.45,812.6
ao,A-kost alt 1,2025-02-12,7,Onsdag,"Kycklinggryta med dragon, ris* och grönsaker","Kycklinggryta med dragon, ris* och grönsaker",418.13,29.53,29.04,9.12,2.26,2.4,337.25
ao,A-kost alt 2,2025-02-12,7,Onsdag,Isterband med persiljestuvad potatis*,Isterband med persiljestuvad potatis*,346.86,13.75,30.0,5.75,1.25,1.0,125.0
ao,Grov Paté alt 1,2025-02-12,7,Onsdag,"Kycklinggryta med dragon paté, grönsaker och kokt ris*","Kycklinggryta med dragon paté, grönsaker och kokt ris*",452.31,17.73,36.52,12.72,2.76,4.06,317.25
ao,Grov Paté alt 2,2025-02-12,7,Onsdag,Isterband med persiljestuvad potatis*,Isterband med persiljestuvad potatis*,346.86,13.75,30.0,5.75,1.25,1.0,125.0
ao,Timbal alt 1,2025-02-12,7,Onsdag,"Kycklinggryta med dragon timbal, grönsaker och ristimbal","Kycklinggryta med dragon timbal, grönsaker och ristimbal",805.28,21.4,64.98,35.03,1.85,3.08,391.25
ao,Timbal alt 2,2025-02-12,7,Onsdag,"Isterband timbal med potatismos, persiljesås och rödbetor","Isterband timbal med potatismos, persiljesås och rödbetor",430.17,20.22,16.97,48.96,3.26,5.54,538.63
ao,A-kost alt 1,2025-02-13,7,Torsdag,Grönkålssoppa med ägghalvor,Grönkålssoppa med ägghalvor,244.42,16.92,12.24,15.49,2.38,1.59,353.11
ao,A-kost alt 2,2025-02-13,7,Torsdag,Isterband med persiljestuvad potatis*,Isterband med persiljestuvad potatis*,346.86,13.75,30.0,5.75,1.25,1.0,125.0
ao,Grov Paté alt 1,2025-02-13,7,Torsdag,Grönkålssoppa med ägghalvor,Grönkålssoppa med ägghalvor,244.42,16.92,12.24,15.49,2.38,1.59,353.11
ao,Grov Paté alt 2,2025-02-13,7,Torsdag,Isterband med persiljestuvad potatis*,Isterband med persiljestuvad potatis*,346.86,13.75,30.0,5.75,1.25,1.0,125.0
ao,Timbal alt 1,2025-02-13,7,Torsdag,Grönkålssoppa slät med äggkräm,Grönkålssoppa slät med äggkräm,244.42,16.92,12.24,15.49,2.38,1.59,353.11
ao,Timbal alt 2,2025-02-13,7,Torsdag,"Isterband timbal med potatismos, persiljesås och rödbetor","Isterband timbal med potatismos, persiljesås och rödbetor",430.17,20.22,16.97,48.96,3.26,5.54,538.63
ao,A-kost alt 1,2025-02-14,7,Fredag,"Schnitzel, skysås, stekt potatis* och grönsaker","Schnitzel, skysås, stekt potatis* och grönsaker",521.09,26.76,22.51,48.66,6.6,2.41,343.75
ao,A-kost alt 2,2025-02-14,7,Fredag,"Persiljejärpar med brunsås, kokt potatis* och grönsaker","Persiljejärpar med brunsås, kokt potatis* och grönsaker",387.68,24.22,24.61,16.3,2.95,4.5,334.29
ao,Grov Paté alt 1,2025-02-14,7,Fredag,"Schnitzel paté, skysås, stekt potatis*, kokta grönsaker","Schnitzel paté, skysås, stekt potatis*, kokta grönsaker",166.5,3.16,11.6,10.66,2.6,0.79,278.75
ao,Grov Paté alt 2,2025-02-14,7,Fredag,"Persiljejärpar med brunsås, kokt potatis* och grönsaker","Persiljejärpar med brunsås, kokt potatis* och grönsaker",387.68,24.22,24.61,16.3,2.95,4.5,334.29
ao,Timbal alt 1,2025-02-14,7,Fredag,"Schnitzel timbal, skysås, stekt potatis, grönsaker","Schnitzel timbal, skysås, stekt potatis, grönsaker",554.5,18.46,34.04,41.87,3.93,2.72,457.8
ao,Timbal alt 2,2025-02-14,7,Fredag,"Persiljejärpar timbal, brunsås, potatismos, grönsakstimbal","Persiljejärpar timbal, brunsås, potatismos, grönsakstimbal",288.86,8.46,12.53,34.15,3.37,3.4,477.27
ao,A-kost alt 1,2025-02-15,7,Lördag,"Citronfisk med kapris, kokt potatis* och grönsaker","Citronfisk med kapris, kokt potatis* och grönsaker",312.71,26.31,18.37,9.47,2.49,0.69,264.95
ao,A-kost alt 2,2025-02-15,7,Lördag,"Persiljejärpar med brunsås, kokt potatis* och grönsaker","Persiljejärpar med brunsås, kokt potatis* och grönsaker",387.68,24.22,24.61,16.3,2.95,4.5,334.29
ao,Grov Paté alt 1,2025-02-15,7,Lördag,"Citronfisk med kapris, kokt potatis* och grönsaker","Citronfisk med kapris, kokt potatis* och grönsaker",312.71,26.31,18.37,9.47,2.49,0.69,264.95
ao,Grov Paté alt 2,2025-02-15,7,Lördag,"Persiljejärpar med brunsås, kokt potatis* och grönsaker","Persiljejärpar med brunsås, kokt potatis* och grönsaker",387.68,24.22,24.61,16.3,2.95,4.5,334.29
ao,Timbal alt 1,2025-02-15,7,Lördag,"Fiskgratäng med kaviar och dill timbal, ärtgrönt mos och grönsaker","Fiskgratäng med kaviar och dill timbal, ärtgrönt mos och grönsaker",734.48,26.82,46.4,49.79,7.55,2.92,545.0
ao,Timbal alt 2,2025-02-15,7,Lördag,"Persiljejärpar timbal, brunsås, potatismos, grönsakstimbal","Persiljejärpar timbal, brunsås, potatismos, grönsakstimbal",288.86,8.46,12.53,34.15,3.37,3.4,477.27
ao,A-kost alt 1,2025-02-16,7,Söndag,Pepparrotskött med kokt potatis* och grönsaker,Pepparrotskött med kokt potatis* och grönsaker,282.98,24.52,14.89,11.29,3.11,0.34,353.9
ao,A-kost alt 2,2025-02-16,7,Söndag,"Persiljejärpar med brunsås, kokt potatis* och grönsaker","Persiljejärpar med brunsås, kokt potatis* och grönsaker",387.68,24.22,24.61,16.3,2.95,4.5,334.29
ao,Grov Paté alt 1,2025-02-16,7,Söndag,"Pepparrotskött paté med kokt potatis*, grönsaker","Pepparrotskött paté med kokt potatis*, grönsaker",124.02,3.11,6.7,11.61,2.58,1.0,298.6
ao,Grov Paté alt 2,2025-02-16,7,Söndag,"Persiljejärpar med brunsås, kokt potatis* och grönsaker","Persiljejärpar med brunsås, kokt potatis* och grönsaker",387.68,24.22,24.61,16.3,2.95,4.5,334.29
ao,Timbal alt 1,2025-02-16,7,Söndag,"Pepparrotskött timbal, ärtgröntmos och grönsak","Pepparrotskött timbal, ärtgröntmos och grönsak",355.89,11.28,13.44,43.42,7.83,1.58,450.0
ao,Timbal alt 2,2025-02-16,7,Söndag,"Persiljejärpar timbal, brunsås, potatismos, grönsakstimbal","Persiljejärpar timbal, brunsås, potatismos, grönsakstimbal",288.86,8.46,12.53,34.15,3.37,3.4,477.27
ao,A-kost alt 1,2025-02-17,8,Måndag,"Stekt fläsk med bruna bönor, kokt potatis* och grönsaker","Stekt fläsk med bruna bönor, kokt potatis* och grönsaker",691.75,30.88,42.9,39.73,13.43,4.3,381.75
ao,A-kost alt 2,2025-02-17,8,Måndag,Lasagne med sallad,Lasagne med sallad,487.58,26.81,20.84,45.72,4.51,2.59,358.0
ao,Grov Paté alt 1,2025-02-17,8,Måndag,"Stekt fläskpaté med bruna bönor, kokt potatis* och grönsaker","Stekt fläskpaté med bruna bönor, kokt potatis* och grönsaker",436.63,25.96,12.63,47.98,13.43,0.7,336.75
ao,Grov Paté alt 2,2025-02-17,8,Måndag,Lasagne med grönsaker,Lasagne med grönsaker,465.11,25.49,18.48,46.01,5.86,2.37,383.0
ao,Timbal alt 1,2025-02-17,8,Måndag,"Stekt fläsktimbal, bönröra, potatismos, grönsaker","Stekt fläsktimbal, bönröra, potatismos, grönsaker",554.86,24.63,25.93,53.04,8.83,1.95,462.75
ao,Timbal alt 2,2025-02-17,8,Måndag,Lasagnetimbal med grönsakstimbal,Lasagnetimbal med grönsakstimbal,593.61,27.82,46.72,18.04,0.91,1.7,340.0
ao,A-kost alt 1,2025-02-18,8,Tisdag,"Stekt spättafilé med potatis*, remouladesås och kokta grönsaker","Stekt spättafilé med potatis*, remouladesås och kokta grönsaker",633.09,26.96,46.52,25.92,4.05,3.9,340.59
ao,A-kost alt 2,2025-02-18,8,Tisdag,Lasagne med sallad,Lasagne med sallad,487.58,26.81,20.84,45.72,4.51,2.59,358.0
ao,Grov Paté alt 1,2025-02-18,8,Tisdag,"Stekt spättafilé med potatis*, remouladesås och kokta grönsaker","Stekt spättafilé med potatis*, remouladesås och kokta grönsaker",633.09,26.96,46.52,25.92,4.05,3.9,340.59
ao,Grov Paté alt 2,2025-02-18,8,Tisdag,Lasagne med grönsaker,Lasagne med grönsaker,465.11,25.49,18.48,46.01,5.86,2.37,383.0
ao,Timbal alt 1,2025-02-18,8,Tisdag,"Panerad torsktimbal med solskensmos, remouladesås slät och grönsakstimbal","Panerad torsktimbal med solskensmos, remouladesås slät och grönsakstimbal",817.88,19.7,61.11,46.56,5.92,1.37,455.34
ao,Timbal alt 2,2025-02-18,8,Tisdag,Lasagnetimbal med grönsakstimbal,Lasagnetimbal med grönsakstimbal,593.61,27.82,46.72,18.04,0.91,1.7,340.0
ao,A-kost alt 1,2025-02-19,8,Onsdag,Kåldolmar med potatis* och brunsås,Kåldolmar med potatis* och brunsås,271.93,13.09,17.11,14.95,3.47,3.81,302.02
ao,A-kost alt 2,2025-02-19,8,Onsdag,Kyckling i currysås med ris* och grönsaker,Kyckling i currysås med ris* och grönsaker,364.81,19.29,27.8,8.6,2.92,1.73,247.05
ao,Grov Paté alt 1,2025-02-19,8,Onsdag,Kåldolmar med potatis* och brunsås,Kåldolmar med potatis* och brunsås,271.93,13.09,17.11,14.95,3.47,3.81,302.02
ao,Grov Paté alt 2,2025-02-19,8,Onsdag,"Kycklingpaté i currysås, ris* och grönsaker","Kycklingpaté i currysås, ris* och grönsaker",422.07,14.18,34.36,12.82,4.45,3.01,251.05
ao,Timbal alt 1,2025-02-19,8,Onsdag,Kåldolmar/pudding timbal med potatismos och brunsås,Kåldolmar/pudding timbal med potatismos och brunsås,366.61,15.46,16.16,39.68,3.07,3.27,453.52
ao,Timbal alt 2,2025-02-19,8,Onsdag,"Kycklingtimbal i currysås, ristimbal och grönsakstimbal","Kycklingtimbal i currysås, ristimbal och grönsakstimbal",764.56,18.42,62.38,32.87,3.65,2.54,326.05
ao,A-kost alt 1,2025-02-20,8,Torsdag,Ärtsoppa med fläsk ÄO,Ärtsoppa med fläsk ÄO,273.85,24.5,2.41,33.14,9.74,2.0,308.0
ao,A-kost alt 2,2025-02-20,8,Torsdag,Kyckling i currysås med ris* och grönsaker,Kyckling i currysås med ris* och grönsaker,364.81,19.29,27.8,8.6,2.92,1.73,247.05
ao,Grov Paté alt 1,2025-02-20,8,Torsdag,Ärtsoppa med fläskpaté ÄO,Ärtsoppa med fläskpaté ÄO,219.71,14.45,0.91,33.14,9.74,0.5,308.0
ao,Grov Paté alt 2,2025-02-20,8,Torsdag,"Kycklingpaté i currysås, ris* och grönsaker","Kycklingpaté i currysås, ris* och grönsaker",422.07,14.18,34.36,12.82,4.45,3.01,251.05
ao,Timbal alt 1,2025-02-20,8,Torsdag,Ärtsoppa slät med fläsktimbal  ÄO,Ärtsoppa slät med fläsktimbal  ÄO,322.49,20.45,7.91,36.89,9.74,1.01,308.0
ao,Timbal alt 2,2025-02-20,8,Torsdag,"Kycklingtimbal i currysås, ristimbal och grönsakstimbal","Kycklingtimbal i currysås, ristimbal och grönsakstimbal",764.56,18.42,62.38,32.87,3.65,2.54,326.05
ao,A-kost alt 1,2025-02-21,8,Fredag,"Biff á la Lindström, brunsås, potatis*, grönsaker","Biff á la Lindström, brunsås, potatis*, grönsaker",175.26,7.23,27.64,14.33,3.1,3.89,321.37
ao,A-kost alt 2,2025-02-21,8,Fredag,"Örtbakad fläskkarré med sås, potatis* och grönsaker","Örtbakad fläskkarré med sås, potatis* och grönsaker",441.99,26.93,31.09,12.83,2.97,2.59,323.88
ao,Grov Paté alt 1,2025-02-21,8,Fredag,"Biff á la Lindström, brunsås, potatis*, grönsaker","Biff á la Lindström, brunsås, potatis*, grönsaker",175.26,7.23,27.64,14.33,3.1,3.89,321.37
ao,Grov Paté alt 2,2025-02-21,8,Fredag,"Örtbakad skinka paté med sås, potatis* och grönsaker","Örtbakad skinka paté med sås, potatis* och grönsaker",128.58,4.45,7.4,10.06,2.19,2.17,277.02
ao,Timbal alt 1,2025-02-21,8,Fredag,"Biff á la Lindström timb, sås potatismos och grönsaker","Biff á la Lindström timb, sås potatismos och grönsaker",499.35,21.71,28.94,37.44,3.32,3.0,466.87
ao,Timbal alt 2,2025-02-21,8,Fredag,"Örtbakad skinka timbal med sås, torghandlarmos och grönsaker","Örtbakad skinka timbal med sås, torghandlarmos och grönsaker",447.92,20.71,20.19,46.15,5.97,3.56,522.02
ao,A-kost alt 1,2025-02-22,8,Lördag,"Laxpudding, skirat smör och grönsaker","Laxpudding, skirat smör och grönsaker",806.19,28.78,60.54,34.83,6.27,2.12,506.3
ao,A-kost alt 2,2025-02-22,8,Lördag,"Örtbakad fläskkarré med sås, potatis* och grönsaker","Örtbakad fläskkarré med sås, potatis* och grönsaker",441.99,26.93,31.09,12.83,2.97,2.59,323.88
ao,Grov Paté alt 1,2025-02-22,8,Lördag,"Laxpudding, skirat smör och grönsaker","Laxpudding, skirat smör och grönsaker",806.19,28.78,60.54,34.83,6.27,2.12,506.3
ao,Grov Paté alt 2,2025-02-22,8,Lördag,"Örtbakad skinka paté med sås, potatis* och grönsaker","Örtbakad skinka paté med sås, potatis* och grönsaker",128.58,4.45,7.4,10.06,2.19,2.17,277.02
ao,Timbal alt 1,2025-02-22,8,Lördag,Laxpudding timbal med skirat smör och grönsak,Laxpudding timbal med skirat smör och grönsak,633.42,20.66,53.55,18.74,2.16,2.82,287.5
ao,Timbal alt 2,2025-02-22,8,Lördag,"Örtbakad skinka timbal, brunsås, torghandlarmos och grönsak","Örtbakad skinka timbal, brunsås, torghandlarmos och grönsak",447.92,20.71,20.19,46.15,5.97,3.56,522.02
ao,A-kost alt 1,2025-02-23,8,Söndag,Skånsk köttgryta med kokt potatis* och grönsaker,Skånsk köttgryta med kokt potatis* och grönsaker,299.99,26.09,14.26,14.75,4.24,2.84,315.68
ao,A-kost alt 2,2025-02-23,8,Söndag,"Örtbakad fläskkarré med sås, potatis* och grönsaker","Örtbakad fläskkarré med sås, potatis* och grönsaker",441.99,26.93,31.09,12.83,2.97,2.59,323.88
ao,Grov Paté alt 1,2025-02-23,8,Söndag,"Skånsk köttgryta paté, potatis* och grönsaker","Skånsk köttgryta paté, potatis* och grönsaker",394.2,11.2,24.97,29.35,4.24,2.7,340.68
ao,Grov Paté alt 2,2025-02-23,8,Söndag,"Örtbakad skinka paté med sås, potatis* och grönsaker","Örtbakad skinka paté med sås, potatis* och grönsaker",128.58,4.45,7.4,10.06,2.19,2.17,277.02
ao,Timbal alt 1,2025-02-23,8,Söndag,"Skånsk köttgryta timbal, torghandlarmos och grönsaker","Skånsk köttgryta timbal, torghandlarmos och grönsaker",580.53,22.9,31.12,50.42,8.16,3.82,545.68
ao,Timbal alt 2,2025-02-23,8,Söndag,"Örtbakad skinka timbal med sås, torghandlarmos och grönsaker","Örtbakad skinka timbal med sås, torghandlarmos och grönsaker",447.92,20.71,20.19,46.15,5.97,3.56,522.02
ao,A-kost alt 1,2025-02-24,9,Måndag,"Kokt köttkorv med potatis*, pepparrotssås och grönsaker","Kokt köttkorv med potatis*, pepparrotssås och grönsaker",434.9,17.86,32.25,17.76,2.66,2.82,309.65
ao,A-kost alt 2,2025-02-24,9,Måndag,Raggmunk med bacon,Raggmunk med bacon,505.05,17.82,33.96,31.42,2.44,3.12,280.06
ao,Grov Paté alt 1,2025-02-24,9,Måndag,"Kokt köttkorv med potatis*, pepparrotssås och grönsaker","Kokt köttkorv med potatis*, pepparrotssås och grönsaker",434.9,17.86,32.25,17.76,2.66,2.82,309.65
ao,Grov Paté alt 2,2025-02-24,9,Måndag,Raggmunk med fläskpaté och grönsaker,Raggmunk med fläskpaté och grönsaker,422.88,17.66,19.3,42.6,4.39,1.59,340.06
ao,Timbal alt 1,2025-02-24,9,Måndag,"Fläskkorv timb med ärtgrönt mos, pepparrotssås och grönsaker","Fläskkorv timb med ärtgrönt mos, pepparrotssås och grönsaker",588.69,26.85,25.22,61.23,8.37,1.47,514.05
ao,Timbal alt 2,2025-02-24,9,Måndag,"Raggmunk timbal med timbalbacon, grönsaker och lingonsås","Raggmunk timbal med timbalbacon, grönsaker och lingonsås",465.11,22.89,24.48,39.29,5.98,3.13,417.77
ao,A-kost alt 1,2025-02-25,9,Tisdag,"Kokt fiskfilé med ägg- och persiljesås, potatis* och grönsaker","Kokt fiskfilé med ägg- och persiljesås, potatis* och grönsaker",217.8,31.21,4.52,11.39,2.34,0.58,260.9
ao,A-kost alt 2,2025-02-25,9,Tisdag,Raggmunk med bacon,Raggmunk med bacon,505.05,17.82,33.96,31.42,2.44,3.12,280.06
ao,Grov Paté alt 1,2025-02-25,9,Tisdag,"Kokt fiskfilé med ägg- och persiljesås, potatis* och grönsaker","Kokt fiskfilé med ägg- och persiljesås, potatis* och grönsaker",217.8,31.21,4.52,11.39,2.34,0.58,260.9
ao,Grov Paté alt 2,2025-02-25,9,Tisdag,Raggmunk med fläskpaté och grönsaker,Raggmunk med fläskpaté och grönsaker,422.88,17.66,19.3,42.6,4.39,1.59,340.06
ao,Timbal alt 1,2025-02-25,9,Tisdag,"Torsktimbal, ägg- och persiljesås, solskensmos, grönsakstimbal","Torsktimbal, ägg- och persiljesås, solskensmos, grönsakstimbal",665.14,24.0,44.02,42.28,5.95,1.47,469.0
ao,Timbal alt 2,2025-02-25,9,Tisdag,"Raggmunk timbal med timbalbacon, grönsaker och lingonsås","Raggmunk timbal med timbalbacon, grönsaker och lingonsås",465.11,22.89,24.48,39.29,5.98,3.13,417.77
ao,A-kost alt 1,2025-02-26,9,Onsdag,Kasslergratäng inkl potatis med grönsaker,Kasslergratäng inkl potatis med grönsaker,362.32,20.55,12.81,38.18,5.41,3.18,408.8
ao,A-kost alt 2,2025-02-26,9,Onsdag,Spagetti* med köttfärssås och sallad,Spagetti* med köttfärssås och sallad,289.11,19.31,18.11,11.26,2.52,2.68,256.7
ao,Grov Paté alt 1,2025-02-26,9,Onsdag,Kasslergratäng inkl. potatis paté med grönsaker,Kasslergratäng inkl. potatis paté med grönsaker,298.94,8.13,11.49,37.88,5.41,0.6,412.8
ao,Grov Paté alt 2,2025-02-26,9,Onsdag,Spagetti* med köttfärssås och grönsaker,Spagetti* med köttfärssås och grönsaker,266.64,17.99,15.75,11.54,3.87,2.47,281.7
ao,Timbal alt 1,2025-02-26,9,Onsdag,"Kasslergratäng timbal, potatismos, grönsakstimbal","Kasslergratäng timbal, potatismos, grönsakstimbal",599.63,18.27,39.63,41.18,4.09,2.56,355.25
ao,Timbal alt 2,2025-02-26,9,Onsdag,Spagetti timbal med köttfärssås och grönsakstimbal,Spagetti timbal med köttfärssås och grönsakstimbal,382.64,23.66,22.98,21.13,2.35,1.57,389.5
ao,A-kost alt 1,2025-02-27,9,Torsdag,Kött- och grönsakssoppa ÄO,Kött- och grönsakssoppa ÄO,134.81,12.34,3.75,11.52,2.47,2.02,301.8
ao,A-kost alt 2,2025-02-27,9,Torsdag,Spagetti* med köttfärssås och sallad,Spagetti* med köttfärssås och sallad,289.11,19.31,18.11,11.26,2.52,2.68,256.7
ao,Grov Paté alt 1,2025-02-27,9,Torsdag,Kött- och grönsakssoppa paté ÄO,Kött- och grönsakssoppa paté ÄO,144.73,4.44,5.9,17.12,2.47,1.92,291.8
ao,Grov Paté alt 2,2025-02-27,9,Torsdag,Spagetti* med köttfärssås och grönsaker,Spagetti* med köttfärssås och grönsaker,266.64,17.99,15.75,11.54,3.87,2.47,281.7
ao,Timbal alt 1,2025-02-27,9,Torsdag,Kött- och grönsakssoppa timbal,Kött- och grönsakssoppa timbal,329.35,14.93,23.12,15.62,0.56,2.32,272.0
ao,Timbal alt 2,2025-02-27,9,Torsdag,Spagetti timbal med köttfärssås och grönsakstimbal,Spagetti timbal med köttfärssås och grönsakstimbal,382.64,23.66,22.98,21.13,2.35,1.57,389.5
ao,A-kost alt 1,2025-02-28,9,Fredag,"Pannbiff med löksås, potatis* och grönsaker","Pannbiff med löksås, potatis* och grönsaker",431.6,25.96,26.52,20.39,4.71,4.96,356.89
