menu_type,alternativ,datum,vecka,veckodag,ratt,ratt_orig,energi_kcal,protein_g,fett_g,kolhydrater_g,kostfibrer_g,salt_g,vikt_g
ao,A-kost alt 2,2025-09-04,36,Torsdag,"Kyckling Milanese med tomatsås, ris* och grönsaker","Kyckling Milanese med tomatsås, ris* och grönsaker",456.11,25.89,23.75,32.86,4.42,0.49,327.04
ao,Grov Paté alt 1,2025-09-04,36,Torsdag,Vitkålssoppa med frikadeller ÄO,Vitkålssoppa med frikadeller ÄO,197.88,7.57,14.32,8.4,3.31,2.69,325.85
ao,Grov Paté alt 2,2025-09-04,36,Torsdag,"Kyckling Milanese med tomatsås, ris* och grönsaker Paté","Kyckling Milanese med tomatsås, ris* och grönsaker Paté",489.81,21.34,28.75,34.66,4.67,1.34,327.04
ao,Timbal alt 1,2025-09-04,36,Torsdag,"Vitkålssoppa slät, färsbullstimbal","Vitkålssoppa slät, färsbullstimbal",223.61,9.15,14.97,11.93,2.98,2.8,324.36
ao,Timbal alt 2,2025-09-04,36,Torsdag,"Kyckling Milanese timbal med tomatsås, ristimbal och grönsak","Kyckling Milanese timbal med tomatsås, ristimbal och grönsak",825.13,26.08,56.33,53.39,3.92,1.34,402.04
ao,A-kost alt 1,2025-09-05,36,Fredag,"Köttfärslimpa med kokt potatis*, gräddsås och grönsaker","Köttfärslimpa med kokt potatis*, gräddsås och grönsaker",224.83,6.85,46.92,15.06,2.89,3.05,380.4
ao,A-kost alt 2,2025-09-05,36,Fredag,Korv Stroganoff med ris* och kokta grönsaker,Korv Stroganoff med ris* och kokta grönsaker,365.79,13.19,27.97,14.63,2.91,2.34,287.51
ao,Grov Paté alt 1,2025-09-05,36,Fredag,"Köttfärslimpa med kokt potatis*, gräddsås och grönsaker","Köttfärslimpa med kokt potatis*, gräddsås och grönsaker",224.83,6.85,46.92,15.06,2.89,3.05,380.4
ao,Grov Paté alt 2,2025-09-05,36,Fredag,Korv Stroganoff med ris* och kokta grönsaker,Korv Stroganoff med ris* och kokta grönsaker,365.79,13.19,27.97,14.63,2.91,2.34,287.51
ao,Timbal alt 1,2025-09-05,36,Fredag,Färsrätt timbal med gräddsås och potatismos och grönsaker,Färsrätt timbal med gräddsås och potatismos och grönsaker,347.73,9.17,18.95,33.99,3.29,3.26,485.55
ao,Timbal alt 2,2025-09-05,36,Fredag,Korv Stroganoff timbal med ristimbal och grönsaker,Korv Stroganoff timbal med ristimbal och grönsaker,614.38,20.77,42.77,37.17,1.94,4.07,390.0
ao,A-kost alt 1,2025-09-06,36,Lördag,"Stekt spättafilé med potatis*, remouladesås och kokta grönsaker","Stekt spättafilé med potatis*, remouladesås och kokta grönsaker",633.09,26.96,46.52,25.92,4.05,3.9,340.59
ao,A-kost alt 2,2025-09-06,36,Lördag,Korv Stroganoff med ris* och kokta grönsaker,Korv Stroganoff med ris* och kokta grönsaker,365.79,13.19,27.97,14.63,2.91,2.34,287.51
ao,Grov Paté alt 1,2025-09-06,36,Lördag,"Stekt spättafilé med potatis*, remouladesås och kokta grönsaker","Stekt spättafilé med potatis*, remouladesås och kokta grönsaker",633.09,26.96,46.52,25.92,4.05,3.9,340.59
ao,Grov Paté alt 2,2025-09-06,36,Lördag,Korv Stroganoff med ris* och kokta grönsaker,Korv Stroganoff med ris* och kokta grönsaker,365.79,13.19,27.97,14.63,2.91,2.34,287.51
ao,Timbal alt 1,2025-09-06,36,Lördag,"Panerad torsktimbal med potatismos, tartarsås och grönsakstimbal","Panerad torsktimbal med potatismos, tartarsås och grönsakstimbal",559.22,18.03,37.77,36.39,3.56,2.32,379.18
ao,Timbal alt 2,2025-09-06,36,Lördag,Korv Stroganoff timbal med ristimbal och grönsaker,Korv Stroganoff timbal med ristimbal och grönsaker,614.38,20.77,42.77,37.17,1.94,4.07,390.0
ao,A-kost alt 1,2025-09-07,36,Söndag,"Helstekt kotlettrad med purjolökspotatis*, bearnaisesås och grönsaker","Helstekt kotlettrad med purjolökspotatis*, bearnaisesås och grönsaker",333.64,18.22,26.73,4.78,1.95,3.97,282.0
ao,A-kost alt 2,2025-09-07,36,Söndag,Korv Stroganoff med ris* och kokta grönsaker,Korv Stroganoff med ris* och kokta grönsaker,365.79,13.19,27.97,14.63,2.91,2.34,287.51
ao,Grov Paté alt 1,2025-09-07,36,Söndag,"Stekt skinkpaté med purjolökspotatis*, bearnaisesås och grönsaker","Stekt skinkpaté med purjolökspotatis*, bearnaisesås och grönsaker",400.87,10.98,35.43,9.59,2.11,1.51,290.0
ao,Grov Paté alt 2,2025-09-07,36,Söndag,Korv Stroganoff med ris* och kokta grönsaker,Korv Stroganoff med ris* och kokta grönsaker,365.79,13.19,27.97,14.63,2.91,2.34,287.51
ao,Timbal alt 1,2025-09-07,36,Söndag,"Stekt skinktimbal med stekt potatis, bearnaisesås, grönsaker","Stekt skinktimbal med stekt potatis, bearnaisesås, grönsaker",635.46,18.02,45.14,38.08,3.92,2.45,469.8
ao,Timbal alt 2,2025-09-07,36,Söndag,Korv Stroganoff timbal med ristimbal och grönsaker,Korv Stroganoff timbal med ristimbal och grönsaker,614.38,20.77,42.77,37.17,1.94,4.07,390.0
ao,A-kost alt 1,2025-09-08,37,Måndag,Köttfärslåda med curry och timjan (inkl potatis) serveras med grönsaker,Köttfärslåda med curry och timjan (inkl potatis) serveras med grönsaker,607.38,30.54,39.12,31.09,5.8,0.44,469.28
ao,A-kost alt 2,2025-09-08,37,Måndag,Raggmunk med bacon och grönsaker,Raggmunk med bacon och grönsaker,529.9,19.38,34.29,34.35,4.39,3.19,345.06
ao,Grov Paté alt 1,2025-09-08,37,Måndag,Köttfärslåda med curry och timjan (inkl potatis) serveras med grönsaker,Köttfärslåda med curry och timjan (inkl potatis) serveras med grönsaker,607.38,30.54,39.12,31.09,5.8,0.44,469.28
ao,Grov Paté alt 2,2025-09-08,37,Måndag,Raggmunk med fläskpaté och grönsaker,Raggmunk med fläskpaté och grönsaker,422.88,17.66,19.3,42.6,4.39,1.59,340.06
ao,Timbal alt 1,2025-09-08,37,Måndag,Köttfärslåda med curry och timjan (inkl potatis) timbal med grönsaktimbal och sås,Köttfärslåda med curry och timjan (inkl potatis) timbal med grönsaktimbal och sås,394.81,16.97,21.99,31.54,2.14,2.72,338.77
ao,Timbal alt 2,2025-09-08,37,Måndag,"Raggmunk timbal med timbalbacon, grönsaker och lingonsås","Raggmunk timbal med timbalbacon, grönsaker och lingonsås",465.11,22.89,24.48,39.29,5.98,3.13,417.77
ao,A-kost alt 1,2025-09-09,37,Tisdag,"Fiskgratäng med skaldjur, kokt potatis* och grönsaker","Fiskgratäng med skaldjur, kokt potatis* och grönsaker",315.59,33.4,12.72,15.54,2.14,2.04,316.35
ao,A-kost alt 2,2025-09-09,37,Tisdag,Raggmunk med bacon och grönsaker,Raggmunk med bacon och grönsaker,529.9,19.38,34.29,34.35,4.39,3.19,345.06
ao,Grov Paté alt 1,2025-09-09,37,Tisdag,"Fiskgratäng med skaldjur, kokt potatis* och grönsaker","Fiskgratäng med skaldjur, kokt potatis* och grönsaker",315.59,33.4,12.72,15.54,2.14,2.04,316.35
ao,Grov Paté alt 2,2025-09-09,37,Tisdag,Raggmunk med fläskpaté och grönsaker,Raggmunk med fläskpaté och grönsaker,422.88,17.66,19.3,42.6,4.39,1.59,340.06
ao,Timbal alt 1,2025-09-09,37,Tisdag,"Fiskgratäng med skaldjur timbal, potatismos, grönsak","Fiskgratäng med skaldjur timbal, potatismos, grönsak",488.46,23.81,23.17,45.7,3.56,2.13,485.25
ao,Timbal alt 2,2025-09-09,37,Tisdag,"Raggmunk timbal med timbalbacon, grönsaker och lingonsås","Raggmunk timbal med timbalbacon, grönsaker och lingonsås",465.11,22.89,24.48,39.29,5.98,3.13,417.77
ao,A-kost alt 1,2025-09-10,37,Onsdag,Kassler i Bergakungenssås med ris* och grönsaker ÄO,Kassler i Bergakungenssås med ris* och grönsaker ÄO,441.46,26.55,33.42,7.89,2.73,4.98,282.4
ao,A-kost alt 2,2025-09-10,37,Onsdag,Lasagne med sallad,Lasagne med sallad,487.58,26.81,20.84,45.72,4.51,2.59,358.0
ao,Grov Paté alt 1,2025-09-10,37,Onsdag,Kassler i Bergakungenssås paté med ris* och grönsaker ÄO,Kassler i Bergakungenssås paté med ris* och grönsaker ÄO,325.26,3.78,31.0,7.34,2.73,0.25,292.4
ao,Grov Paté alt 2,2025-09-10,37,Onsdag,Lasagne med grönsaker,Lasagne med grönsaker,465.11,25.49,18.48,46.01,5.86,2.37,383.0
ao,Timbal alt 1,2025-09-10,37,Onsdag,Kassler i Bergakungenssås timbal med ristimbal och grönsaker ÄO,Kassler i Bergakungenssås timbal med ristimbal och grönsaker ÄO,795.6,20.98,65.19,33.7,2.18,1.47,359.4
ao,Timbal alt 2,2025-09-10,37,Onsdag,Lasagnetimbal med grönsakstimbal,Lasagnetimbal med grönsakstimbal,593.61,27.82,46.72,18.04,0.91,1.7,340.0
ao,A-kost alt 1,2025-09-11,37,Torsdag,Ärtsoppa med fläsk,Ärtsoppa med fläsk,273.85,24.5,2.41,33.14,9.74,2.0,308.0
ao,A-kost alt 2,2025-09-11,37,Torsdag,Lasagne med sallad,Lasagne med sallad,487.58,26.81,20.84,45.72,4.51,2.59,358.0
ao,Grov Paté alt 1,2025-09-11,37,Torsdag,Ärtsoppa med patéfläsk,Ärtsoppa med patéfläsk,219.71,14.45,0.91,33.14,9.74,0.5,308.0
ao,Grov Paté alt 2,2025-09-11,37,Torsdag,Lasagne med grönsaker,Lasagne med grönsaker,465.11,25.49,18.48,46.01,5.86,2.37,383.0
ao,Timbal alt 1,2025-09-11,37,Torsdag,Ärtsoppa slät med timbalfläsk,Ärtsoppa slät med timbalfläsk,322.49,20.45,7.91,36.89,9.74,1.01,308.0
ao,Timbal alt 2,2025-09-11,37,Torsdag,Lasagnetimbal med grönsakstimbal,Lasagnetimbal med grönsakstimbal,593.61,27.82,46.72,18.04,0.91,1.7,340.0
ao,A-kost alt 1,2025-09-12,37,Fredag,"Wallenbergare med mos*, skirat smör och kokta grönsaker","Wallenbergare med mos*, skirat smör och kokta grönsaker",837.26,29.87,74.31,12.99,3.09,1.1,320.75
ao,A-kost alt 2,2025-09-12,37,Fredag,"Örtbakad fläskkarré med sås, potatis* och grönsaker","Örtbakad fläskkarré med sås, potatis* och grönsaker",441.99,26.93,31.09,12.83,2.97,2.59,323.88
ao,Grov Paté alt 1,2025-09-12,37,Fredag,"Wallenbergare med mos*, skirat smör och kokta grönsaker","Wallenbergare med mos*, skirat smör och kokta grönsaker",837.26,29.87,74.31,12.99,3.09,1.1,320.75
ao,Grov Paté alt 2,2025-09-12,37,Fredag,"Örtbakad skinka paté med sås, potatis* och grönsaker","Örtbakad skinka paté med sås, potatis* och grönsaker",128.58,4.45,7.4,10.06,2.19,2.17,277.02
ao,Timbal alt 1,2025-09-12,37,Fredag,"Järptimbal, skirat smör, potatismos och grönsak","Järptimbal, skirat smör, potatismos och grönsak",493.05,4.52,40.73,26.18,4.28,1.51,417.75
ao,Timbal alt 2,2025-09-12,37,Fredag,"Örtbakad skinka timbal med sås, torghandlarmos och grönsaker","Örtbakad skinka timbal med sås, torghandlarmos och grönsaker",447.92,20.71,20.19,46.15,5.97,3.56,522.02
ao,A-kost alt 1,2025-09-13,37,Lördag,"Kokt lax med potatis*, hollandaisesås och kokta grönsaker","Kokt lax med potatis*, hollandaisesås och kokta grönsaker",537.28,26.24,42.86,11.63,1.95,0.7,297.7
ao,A-kost alt 2,2025-09-13,37,Lördag,"Örtbakad fläskkarré med sås, potatis* och grönsaker","Örtbakad fläskkarré med sås, potatis* och grönsaker",441.99,26.93,31.09,12.83,2.97,2.59,323.88
ao,Grov Paté alt 1,2025-09-13,37,Lördag,"Kokt lax med potatis*, hollandaisesås och kokta grönsaker","Kokt lax med potatis*, hollandaisesås och kokta grönsaker",537.28,26.24,42.86,11.63,1.95,0.7,297.7
ao,Grov Paté alt 2,2025-09-13,37,Lördag,"Örtbakad skinka paté med sås, potatis* och grönsaker","Örtbakad skinka paté med sås, potatis* och grönsaker",128.58,4.45,7.4,10.06,2.19,2.17,277.02
ao,Timbal alt 1,2025-09-13,37,Lördag,"Kokt laxtimbal med potatismos, hollandaisesås och grönsaker","Kokt laxtimbal med potatismos, hollandaisesås och grönsaker",558.56,13.24,38.99,38.08,3.17,1.66,420.25
ao,Timbal alt 2,2025-09-13,37,Lördag,"Örtbakad skinka timbal, brunsås, torghandlarmos och grönsak","Örtbakad skinka timbal, brunsås, torghandlarmos och grönsak",447.92,20.71,20.19,46.15,5.97,3.56,522.02
ao,A-kost alt 1,2025-09-14,37,Söndag,Skånsk köttgryta med kokt potatis* och grönsaker,Skånsk köttgryta med kokt potatis* och grönsaker,299.99,26.09,14.26,14.75,4.24,2.84,315.68
ao,A-kost alt 2,2025-09-14,37,Söndag,"Örtbakad fläskkarré med sås, potatis* och grönsaker","Örtbakad fläskkarré med sås, potatis* och grönsaker",441.99,26.93,31.09,12.83,2.97,2.59,323.88
ao,Grov Paté alt 1,2025-09-14,37,Söndag,"Skånsk köttgryta paté, potatis* och grönsaker","Skånsk köttgryta paté, potatis* och grönsaker",394.2,11.2,24.97,29.35,4.24,2.7,340.68
ao,Grov Paté alt 2,2025-09-14,37,Söndag,"Örtbakad skinka paté med sås, potatis* och grönsaker","Örtbakad skinka paté med sås, potatis* och grönsaker",128.58,4.45,7.4,10.06,2.19,2.17,277.02
ao,Timbal alt 1,2025-09-14,37,Söndag,"Skånsk köttgryta timbal, torghandlarmos och grönsaker","Skånsk köttgryta timbal, torghandlarmos och grönsaker",580.53,22.9,31.12,50.42,8.16,3.82,545.68
ao,Timbal alt 2,2025-09-14,37,Söndag,"Örtbakad skinka timbal med sås, torghandlarmos och grönsaker","Örtbakad skinka timbal med sås, torghandlarmos och grönsaker",447.92,20.71,20.19,46.15,5.97,3.56,522.02
ao,A-kost alt 1,2025-09-15,38,Måndag,"Stekt fläsk med bruna bönor, kokt potatis* och grönsaker","Stekt fläsk med bruna bönor, kokt potatis* och grönsaker",691.75,30.88,42.9,39.73,13.43,4.3,381.75
ao,A-kost alt 2,2025-09-15,38,Måndag,Champinjonsoppa ÄO,Champinjonsoppa ÄO,283.73,9.75,20.65,14.73,1.07,0.77,301.95
ao,Grov Paté alt 1,2025-09-15,38,Måndag,"Stekt fläskpaté med bruna bönor, kokt potatis* och grönsaker","Stekt fläskpaté med bruna bönor, kokt potatis* och grönsaker",436.63,25.96,12.63,47.98,13.43,0.7,336.75
ao,Grov Paté alt 2,2025-09-15,38,Måndag,Champinjonsoppa ÄO,Champinjonsoppa ÄO,283.73,9.75,20.65,14.73,1.07,0.77,301.95
ao,Timbal alt 1,2025-09-15,38,Måndag,"Stekt fläsktimbal, bönröra, potatismos, grönsaker","Stekt fläsktimbal, bönröra, potatismos, grönsaker",554.86,24.63,25.93,53.04,8.83,1.95,462.75
ao,Timbal alt 2,2025-09-15,38,Måndag,Champinjonsoppa slät ÄO,Champinjonsoppa slät ÄO,272.99,9.5,20.59,12.52,0.96,0.77,298.9
ao,A-kost alt 1,2025-09-16,38,Tisdag,"Pankopanerad fisk med potatis*, dillmajonnäs och grönsaker","Pankopanerad fisk med potatis*, dillmajonnäs och grönsaker",945.89,26.45,88.17,13.53,2.05,1.94,342.51
ao,A-kost alt 2,2025-09-16,38,Tisdag,Champinjonsoppa ÄO,Champinjonsoppa ÄO,283.73,9.75,20.65,14.73,1.07,0.77,301.95
ao,Grov Paté alt 1,2025-09-16,38,Tisdag,"Pankopanerad fisk med potatis*, dillmajonnäs och grönsaker","Pankopanerad fisk med potatis*, dillmajonnäs och grönsaker",945.89,26.45,88.17,13.53,2.05,1.94,342.51
ao,Grov Paté alt 2,2025-09-16,38,Tisdag,Champinjonsoppa ÄO,Champinjonsoppa ÄO,283.73,9.75,20.65,14.73,1.07,0.77,301.95
ao,Timbal alt 1,2025-09-16,38,Tisdag,"Panerad torsktimbal, dillmajonnäs, palsternacksmos och grönsakstimbal","Panerad torsktimbal, dillmajonnäs, palsternacksmos och grönsakstimbal",1118.65,20.13,94.7,48.12,7.41,2.23,485.42
ao,Timbal alt 2,2025-09-16,38,Tisdag,Champinjonsoppa slät ÄO,Champinjonsoppa slät ÄO,272.99,9.5,20.59,12.52,0.96,0.77,298.9
ao,A-kost alt 1,2025-09-17,38,Onsdag,"Chili con carne, ris* och grönsaker ÄO","Chili con carne, ris* och grönsaker ÄO",395.21,23.93,18.72,27.62,10.69,2.36,371.79
ao,A-kost alt 2,2025-09-17,38,Onsdag,Kycklinglevergryta serveras med ris* och kokta grönsaker,Kycklinglevergryta serveras med ris* och kokta grönsaker,499.87,34.69,34.68,11.15,3.76,3.09,401.69
ao,Grov Paté alt 1,2025-09-17,38,Onsdag,"Chili con carne, ris* och grönsaker ÄO","Chili con carne, ris* och grönsaker ÄO",395.21,23.93,18.72,27.62,10.69,2.36,371.79
ao,Grov Paté alt 2,2025-09-17,38,Onsdag,Kycklinglevergryta paté serveras med ris* och kokta grönsaker,Kycklinglevergryta paté serveras med ris* och kokta grönsaker,379.33,30.0,23.2,11.15,3.76,2.39,366.69
ao,Timbal alt 1,2025-09-17,38,Onsdag,Chili con carne timbal med ris och grönsaker ÄO,Chili con carne timbal med ris och grönsaker ÄO,505.53,16.05,32.77,36.87,3.25,1.11,360.0
ao,Timbal alt 2,2025-09-17,38,Onsdag,Kycklinglevergryta timbal serveras med potatismos och grönsakstimbal,Kycklinglevergryta timbal serveras med potatismos och grönsakstimbal,662.24,24.8,41.08,48.3,5.08,4.34,571.94
ao,A-kost alt 1,2025-09-18,38,Torsdag,Kött- och grönsakssoppa ÄO,Kött- och grönsakssoppa ÄO,134.81,12.34,3.75,11.52,2.47,2.02,301.8
ao,A-kost alt 2,2025-09-18,38,Torsdag,Kycklinglevergryta serveras med ris* och kokta grönsaker,Kycklinglevergryta serveras med ris* och kokta grönsaker,499.87,34.69,34.68,11.15,3.76,3.09,401.69
ao,Grov Paté alt 1,2025-09-18,38,Torsdag,Kött- och grönsakssoppa paté ÄO,Kött- och grönsakssoppa paté ÄO,144.73,4.44,5.9,17.12,2.47,1.92,291.8
ao,Grov Paté alt 2,2025-09-18,38,Torsdag,Kycklinglevergryta paté serveras med ris* och kokta grönsaker,Kycklinglevergryta paté serveras med ris* och kokta grönsaker,379.33,30.0,23.2,11.15,3.76,2.39,366.69
ao,Timbal alt 1,2025-09-18,38,Torsdag,Kött- och grönsakssoppa timbal,Kött- och grönsakssoppa timbal,329.35,14.93,23.12,15.62,0.56,2.32,272.0
ao,Timbal alt 2,2025-09-18,38,Torsdag,Kycklinglevergryta timbal serveras med potatismos och grönsakstimbal,Kycklinglevergryta timbal serveras med potatismos och grönsakstimbal,662.24,24.8,41.08,48.3,5.08,4.34,571.94
ao,A-kost alt 1,2025-09-19,38,Fredag,"Kåldolmar, gräddsås och potatis*","Kåldolmar, gräddsås och potatis*",330.8,13.81,23.52,14.79,3.39,3.66,310.3
ao,A-kost alt 2,2025-09-19,38,Fredag,Dillkött med kokt potatis* och grönsaker,Dillkött med kokt potatis* och grönsaker,366.17,29.39,22.2,11.04,2.89,15.77,308.16
ao,Grov Paté alt 1,2025-09-19,38,Fredag,"Kåldolmar, gräddsås och potatis*","Kåldolmar, gräddsås och potatis*",330.8,13.81,23.52,14.79,3.39,3.66,310.3
ao,Grov Paté alt 2,2025-09-19,38,Fredag,"Dillkött, grov paté med potatis* och grönsaker","Dillkött, grov paté med potatis* och grönsaker",128.01,3.39,6.68,12.66,2.36,1.29,295.0
ao,Timbal alt 1,2025-09-19,38,Fredag,"Kålpudding timbal, gräddsås, potatismos och grönsakstimbal","Kålpudding timbal, gräddsås, potatismos och grönsakstimbal",488.58,18.97,26.58,43.52,3.8,3.54,501.8
ao,Timbal alt 2,2025-09-19,38,Fredag,Dillkött timbal med mos och grönsak,Dillkött timbal med mos och grönsak,366.51,17.07,14.46,41.54,3.38,1.59,355.25
ao,A-kost alt 1,2025-09-20,38,Lördag,"Citronfisk med kapris, kokt potatis* och grönsaker","Citronfisk med kapris, kokt potatis* och grönsaker",312.71,26.31,18.37,9.47,2.49,0.69,264.95
ao,A-kost alt 2,2025-09-20,38,Lördag,Dillkött med kokt potatis* och grönsaker,Dillkött med kokt potatis* och grönsaker,366.17,29.39,22.2,11.04,2.89,15.77,308.16
ao,Grov Paté alt 1,2025-09-20,38,Lördag,"Citronfisk med kapris, kokt potatis* och grönsaker","Citronfisk med kapris, kokt potatis* och grönsaker",312.71,26.31,18.37,9.47,2.49,0.69,264.95
ao,Grov Paté alt 2,2025-09-20,38,Lördag,"Dillkött, grov paté med potatis* och grönsaker","Dillkött, grov paté med potatis* och grönsaker",128.01,3.39,6.68,12.66,2.36,1.29,295.0
ao,Timbal alt 1,2025-09-20,38,Lördag,"Kokt torsktimbal med citronsås, potatismos och grönsakstimbal","Kokt torsktimbal med citronsås, potatismos och grönsakstimbal",497.36,22.05,24.84,45.44,3.31,2.52,444.75
ao,Timbal alt 2,2025-09-20,38,Lördag,Dillkött timbal med mos och grönsak,Dillkött timbal med mos och grönsak,366.51,17.07,14.46,41.54,3.38,1.59,355.25
ao,A-kost alt 1,2025-09-21,38,Söndag,"Stekt kyckling med potatisgratäng*, skysås och grönsaker","Stekt kyckling med potatisgratäng*, skysås och grönsaker",293.41,27.34,16.29,8.42,2.12,2.17,277.25
ao,A-kost alt 2,2025-09-21,38,Söndag,Dillkött med kokt potatis* och grönsaker,Dillkött med kokt potatis* och grönsaker,366.17,29.39,22.2,11.04,2.89,15.77,308.16
ao,Grov Paté alt 1,2025-09-21,38,Söndag,"Stekt kycklingpaté med potatisgratäng*, skysås och grönsaker","Stekt kycklingpaté med potatisgratäng*, skysås och grönsaker",278.2,12.99,19.98,10.81,2.36,2.35,268.0
ao,Grov Paté alt 2,2025-09-21,38,Söndag,"Dillkött, grov paté med potatis* och grönsaker","Dillkött, grov paté med potatis* och grönsaker",128.01,3.39,6.68,12.66,2.36,1.29,295.0
ao,Timbal alt 1,2025-09-21,38,Söndag,"Stekt kycklingtimbal med skysås, potatisgratäng och grönsaker","Stekt kycklingtimbal med skysås, potatisgratäng och grönsaker",615.94,20.63,37.32,48.03,4.2,1.35,555.4
ao,Timbal alt 2,2025-09-21,38,Söndag,Dillkött timbal med mos och grönsak,Dillkött timbal med mos och grönsak,366.51,17.07,14.46,41.54,3.38,1.59,355.25
ao,A-kost alt 1,2025-09-22,39,Måndag,Isterband med persiljestuvad potatis*,Isterband med persiljestuvad potatis*,346.86,13.75,30.0,5.75,1.25,1.0,125.0
ao,A-kost alt 2,2025-09-22,39,Måndag,Redd grönsakssoppa ÄO,Redd grönsakssoppa ÄO,193.21,6.67,10.5,16.86,2.57,0.25,250.75
ao,Grov Paté alt 1,2025-09-22,39,Måndag,Isterband med persiljestuvad potatis*,Isterband med persiljestuvad potatis*,346.86,13.75,30.0,5.75,1.25,1.0,125.0
ao,Grov Paté alt 2,2025-09-22,39,Måndag,Redd grönsakssoppa paté,Redd grönsakssoppa paté,156.75,4.43,10.25,11.3,1.21,0.2,189.25
ao,Timbal alt 1,2025-09-22,39,Måndag,"Isterband timbal med potatismos, persiljesås och rödbetor","Isterband timbal med potatismos, persiljesås och rödbetor",430.17,20.22,16.97,48.96,3.26,5.54,538.63
ao,Timbal alt 2,2025-09-22,39,Måndag,Redd grönsakssoppa slät,Redd grönsakssoppa slät,256.31,9.47,14.5,20.86,3.37,0.67,290.75
ao,A-kost alt 1,2025-09-23,39,Tisdag,"Stekt strömming med potatismos*, skirat smör och kokta grönsaker","Stekt strömming med potatismos*, skirat smör och kokta grönsaker",580.65,18.94,52.85,7.12,3.97,4.46,227.19
ao,A-kost alt 2,2025-09-23,39,Tisdag,Redd grönsakssoppa ÄO,Redd grönsakssoppa ÄO,193.21,6.67,10.5,16.86,2.57,0.25,250.75
ao,Grov Paté alt 1,2025-09-23,39,Tisdag,"Stekt strömming med potatismos*, skirat smör och kokta grönsaker","Stekt strömming med potatismos*, skirat smör och kokta grönsaker",580.65,18.94,52.85,7.12,3.97,4.46,227.19
ao,Grov Paté alt 2,2025-09-23,39,Tisdag,Redd grönsakssoppa paté,Redd grönsakssoppa paté,156.75,4.43,10.25,11.3,1.21,0.2,189.25
ao,Timbal alt 1,2025-09-23,39,Tisdag,"Stekt strömming timbal med palsternacksmos, skirat smör och grönsaker","Stekt strömming timbal med palsternacksmos, skirat smör och grönsaker",774.28,24.98,57.26,39.58,7.63,1.65,463.68
ao,Timbal alt 2,2025-09-23,39,Tisdag,Redd grönsakssoppa slät,Redd grönsakssoppa slät,256.31,9.47,14.5,20.86,3.37,0.67,290.75
ao,A-kost alt 1,2025-09-24,39,Onsdag,"Kokt kycklingfilé med currysås, ris* och grönsaker","Kokt kycklingfilé med currysås, ris* och grönsaker",333.09,31.34,16.41,13.83,2.47,2.9,321.23
ao,A-kost alt 2,2025-09-24,39,Onsdag,"Fläskköttgryta med dijonsenap, potatis* och grönsaker","Fläskköttgryta med dijonsenap, potatis* och grönsaker",608.54,21.05,51.12,15.54,4.06,0.48,347.0
ao,Grov Paté alt 1,2025-09-24,39,Onsdag,"Kokt kycklingpaté med currysås, ris* och grönsaker","Kokt kycklingpaté med currysås, ris* och grönsaker",366.12,19.44,24.17,16.71,2.87,3.23,325.13
ao,Grov Paté alt 2,2025-09-24,39,Onsdag,"Fläskköttgryta med dijonsenap paté, potatis*, grönsaker","Fläskköttgryta med dijonsenap paté, potatis*, grönsaker",626.33,14.41,53.76,20.74,4.22,1.28,347.0
ao,Timbal alt 1,2025-09-24,39,Onsdag,"Kokt kycklingtimbal med currysås, ristimbal och grönsaker","Kokt kycklingtimbal med currysås, ristimbal och grönsaker",710.05,23.58,52.28,37.02,2.06,2.66,400.13
ao,Timbal alt 2,2025-09-24,39,Onsdag,"Fläskköttgryta m dijonsenap timb, palsternacksmos, grönsaker","Fläskköttgryta m dijonsenap timb, palsternacksmos, grönsaker",903.73,21.48,64.83,56.96,9.82,1.63,573.0
ao,A-kost alt 1,2025-09-25,39,Torsdag,Ärtsoppa med fläsk,Ärtsoppa med fläsk,273.85,24.5,2.41,33.14,9.74,2.0,308.0
ao,A-kost alt 2,2025-09-25,39,Torsdag,"Fläskköttgryta med dijonsenap, potatis* och grönsaker","Fläskköttgryta med dijonsenap, potatis* och grönsaker",608.54,21.05,51.12,15.54,4.06,0.48,347.0
ao,Grov Paté alt 1,2025-09-25,39,Torsdag,Ärtsoppa med patéfläsk,Ärtsoppa med patéfläsk,219.71,14.45,0.91,33.14,9.74,0.5,308.0
ao,Grov Paté alt 2,2025-09-25,39,Torsdag,"Fläskköttgryta med dijonsenap paté, potatis*, grönsaker","Fläskköttgryta med dijonsenap paté, potatis*, grönsaker",626.33,14.41,53.76,20.74,4.22,1.28,347.0
ao,Timbal alt 1,2025-09-25,39,Torsdag,Ärtsoppa slät med timbalfläsk,Ärtsoppa slät med timbalfläsk,322.49,20.45,7.91,36.89,9.74,1.01,308.0
ao,Timbal alt 2,2025-09-25,39,Torsdag,"Fläskköttgryta m dijonsenap timb, palsternacksmos, grönsaker","Fläskköttgryta m dijonsenap timb, palsternacksmos, grönsaker",903.73,21.48,64.83,56.96,9.82,1.63,573.0
ao,A-kost alt 1,2025-09-26,39,Fredag,Viltfärsbiff med potatismos* svampsås och grönsaker,Viltfärsbiff med potatismos* svampsås och grönsaker,572.03,37.47,47.3,23.54,4.22,2.55,473.96
ao,A-kost alt 2,2025-09-26,39,Fredag,Biff Stroganoff med ris* och grönsaker,Biff Stroganoff med ris* och grönsaker,468.1,30.21,30.91,15.03,5.86,2.96,452.27
ao,Grov Paté alt 1,2025-09-26,39,Fredag,Viltfärsbiff med potatismos* svampsås och grönsaker,Viltfärsbiff med potatismos* svampsås och grönsaker,572.03,37.47,47.3,23.54,4.22,2.55,473.96
ao,Grov Paté alt 2,2025-09-26,39,Fredag,Biff Stroganoff paté med ris* och kokta grönsaker,Biff Stroganoff paté med ris* och kokta grönsaker,369.39,9.47,24.88,25.28,4.1,3.02,308.09
ao,Timbal alt 1,2025-09-26,39,Fredag,"Järptimbal med potatismos, svampsås slät och grönsak","Järptimbal med potatismos, svampsås slät och grönsak",552.66,21.15,30.98,45.61,5.53,2.35,761.33
ao,Timbal alt 2,2025-09-26,39,Fredag,Biff Stroganoff timbal med ristimb och grönsaker,Biff Stroganoff timbal med ristimb och grönsaker,702.04,20.81,52.35,36.87,3.69,3.98,383.09
ao,A-kost alt 1,2025-09-27,39,Lördag,"Fisk med täcke, kokt potatis* och grönsak","Fisk med täcke, kokt potatis* och grönsak",318.31,27.66,17.24,11.11,4.17,0.58,334.28
ao,A-kost alt 2,2025-09-27,39,Lördag,Biff Stroganoff med ris* och grönsaker,Biff Stroganoff med ris* och grönsaker,468.1,30.21,30.91,15.03,5.86,2.96,452.27
ao,Grov Paté alt 1,2025-09-27,39,Lördag,"Fisk med täcke, kokt potatis* och grönsak","Fisk med täcke, kokt potatis* och grönsak",318.31,27.66,17.24,11.11,4.17,0.58,334.28
ao,Grov Paté alt 2,2025-09-27,39,Lördag,Biff Stroganoff paté med ris* och kokta grönsaker,Biff Stroganoff paté med ris* och kokta grönsaker,369.39,9.47,24.88,25.28,4.1,3.02,308.09
ao,Timbal alt 1,2025-09-27,39,Lördag,"Fisk med täcke timbal, grönsaktimbal och torghandlarmos","Fisk med täcke timbal, grönsaktimbal och torghandlarmos",685.56,28.02,44.44,43.76,6.51,2.78,495.28
