menu_type,alternativ,datum,vecka,veckodag,ratt,ratt_orig,energi_kcal,protein_g,fett_g,kolhydrater_g,kostfibrer_g,salt_g,vikt_g
skola,Dagens lunch,2025-01-08,2,Onsdag,Thaigryta med kyckling och äggnudlar,S Thaigryta med kyckling och äggnudlar,540.15,28.96,21.72,54.32,5.05,0.82,404.05
skola,Vegetarisk lunch,2025-01-08,2,Onsdag,Choladesgryta serveras med nudlar,S Choladesgryta serveras med nudlar,657.83,28.22,32.39,60.6,5.39,2.12,421.8
skola,Dagens lunch,2025-01-09,2,Torsdag,Sprödbakad torsk serveras med potatis och remouladsås,S Sprödbakad torsk serveras med potatis och remouladsås S,461.86,19.96,22.61,42.85,3.49,2.2,310.38
skola,Vegetarisk lunch,2025-01-09,2,Torsdag,Färgglad grönsakspaj,S Färgglad grönsakspaj,211.1,13.15,13.23,7.86,4.49,2.51,317.79
skola,Dagens lunch,2025-01-10,2,Fredag,Spaghetti med köttfärssås,S Spaghetti med köttfärssås  S,451.51,19.11,13.83,59.72,4.66,3.57,320.26
skola,Vegetarisk lunch,2025-01-10,2,Fredag,Spaghetti med vegetarisk färssås,S Spaghetti med vegetarisk färssås,408.15,17.38,10.2,57.44,7.28,3.37,360.21
skola,Dagens lunch,2025-01-13,3,Måndag,Nasi Goreng (veg) serveras med kall sås,S Nasi Goreng (veg) serveras med kall sås,433.12,15.36,17.71,50.59,3.73,2.59,347.71
skola,Dagens lunch,2025-01-14,3,Tisdag,"Fiskburgare serveras med bröd, mos och remoulad","S Fiskburgare serveras med bröd, mos och remoulad",789.82,26.82,30.18,98.15,8.05,3.35,411.89
skola,Vegetarisk lunch,2025-01-14,3,Tisdag,"Quornburgare med bröd, mos och remoulad","S Quornburgare med bröd, mos och remoulad",424.78,9.28,13.8,60.91,8.94,2.84,269.81
skola,Dagens lunch,2025-01-15,3,Onsdag,Pasta serveras med broccoli- och kycklingsås,S Pasta serveras med broccoli- och kycklingsås S,462.94,26.06,11.11,59.68,8.49,1.63,400.15
skola,Vegetarisk lunch,2025-01-15,3,Onsdag,Mac n´cheese med grönt,S Mac n´cheese med grönt,350.02,14.26,15.86,35.44,4.12,0.34,259.42
skola,Dagens lunch,2025-01-16,3,Torsdag,Ärtsoppa och pannkaka med sylt,S Ärtsoppa och pannkaka med sylt,492.64,23.75,7.96,74.59,11.99,0.72,432.25
skola,Vegetarisk lunch,2025-01-16,3,Torsdag,Currykryddad Grönsakssoppa pannkaka och sylt,S Currykryddad Grönsakssoppa pannkaka och sylt,1508.9,34.35,12.59,284.62,50.4,3.38,2443.61
skola,Dagens lunch,2025-01-17,3,Fredag,Tikka Masala serveras med ris,S Tikka Masala serveras med ris,536.69,30.79,18.46,58.89,4.08,3.04,490.15
skola,Vegetarisk lunch,2025-01-17,3,Fredag,Vegetarisk Tikka Masala serveras med ris,S Vegetarisk Tikka Masala serveras med ris,606.77,33.74,21.58,66.55,3.6,3.51,496.75
skola,Dagens lunch,2025-01-20,4,Måndag,Ostgratinerad korv serveras med potatismos,Ostgratinerad korv serveras med potatismos S,372.07,16.67,22.84,23.91,2.59,2.85,254.81
skola,Vegetarisk lunch,2025-01-20,4,Måndag,Vegetarisk korv serveras med potatismos och ketchup,S Vegetarisk korv serveras med potatismos och ketchup,551.51,25.45,26.86,49.22,5.36,4.98,334.81
skola,Dagens lunch,2025-01-21,4,Tisdag,Spaghetti serveras med het sås (tomat och bönor),S Spaghetti serveras med het sås (tomat och bönor),441.96,15.79,9.72,66.99,10.33,2.73,467.82
skola,Dagens lunch,2025-01-22,4,Onsdag,Fiskpanetter serveras med potatis och stuvad spenat,S Fiskpanetter serveras med potatis och stuvad spenat,376.33,22.29,11.7,44.2,3.24,2.91,362.95
skola,Vegetarisk lunch,2025-01-22,4,Onsdag,Broccolimedaljonger serveras med potatis och örtsås,S Broccolimedaljonger serveras med potatis och örtsås S,497.16,10.81,26.8,50.78,5.2,0.96,318.17
skola,Dagens lunch,2025-01-23,4,Torsdag,Kycklingwok med nudlar och kall currysås,S Kycklingwok med nudlar och kall currysås,480.21,21.06,25.36,39.98,4.18,0.79,297.89
skola,Vegetarisk lunch,2025-01-23,4,Torsdag,Grönsakswok med nudlar och kall currysås,S Grönsakswok med nudlar och kall currysås,570.86,17.1,25.67,63.31,8.97,0.58,388.92
skola,Dagens lunch,2025-01-24,4,Fredag,"Köttfärslimpa serveras med potatis ,brunsås och lingon","S Köttfärslimpa serveras med potatis ,brunsås och lingon",389.52,18.3,15.8,41.3,3.8,2.18,376.65
skola,Vegetarisk lunch,2025-01-24,4,Fredag,"Bouletter serveras med potatis, brunsås och lingon","S Bouletter serveras med potatis, brunsås och lingon",364.41,15.85,12.72,42.81,6.95,2.83,352.4
skola,Dagens lunch,2025-01-27,5,Måndag,Kassler med potatisgratäng,Kassler med potatisgratäng S,302.08,26.81,9.42,25.71,2.66,4.73,301.29
skola,Dagens lunch,2025-01-28,5,Tisdag,Västerhavsfisk serveras med kokt potatis och kall dillsås,S Västerhavsfisk serveras med kokt potatis och kall dillsås,463.24,21.54,20.51,43.65,2.92,0.91,323.39
skola,Vegetarisk lunch,2025-01-28,5,Tisdag,Frittatagratäng,S Frittatagratäng,511.62,23.14,22.44,50.62,6.86,0.61,358.6
skola,Dagens lunch,2025-01-29,5,Onsdag,Potatisbullar serveras med skivad korv och lingonsylt,S Potatisbullar serveras med skivad korv och lingonsylt,450.41,17.56,18.61,50.24,5.35,3.2,280.0
skola,Vegetarisk lunch,2025-01-29,5,Onsdag,Potatisbullar med veg. korv och lingonsylt,S Potatisbullar med veg. korv och lingonsylt,496.2,17.26,21.75,55.02,5.15,3.34,260.0
skola,Dagens lunch,2025-01-30,5,Torsdag,"Tomatsoppa med linser serveras med bröd, ost och frukt","S Tomatsoppa med linser serveras med bröd, ost och frukt",274.9,11.62,4.71,41.25,9.42,1.16,466.38
skola,Vegetarisk lunch,2025-01-30,5,Torsdag,"Redd grönsakssoppa serveras med bröd, ost och frukt","S Redd grönsakssoppa serveras med bröd, ost och frukt S",323.32,12.81,12.47,35.4,8.91,1.44,470.2
skola,Dagens lunch,2025-01-31,5,Fredag,"Schnitzel med kokt potatis, brunsås och ärtor","S Schnitzel med kokt potatis, brunsås och ärtor",433.94,27.89,14.8,43.3,6.95,3.42,407.4
skola,Vegetarisk lunch,2025-01-31,5,Fredag,"Couscous schnitzel, kokt potatis, ärtor och brunsås","S Couscous schnitzel, kokt potatis, ärtor och brunsås",374.41,13.46,17.29,62.24,5.75,1.85,412.5
skola,Dagens lunch,2025-02-03,6,Måndag,Pasta penne serveras med krämig paprikasås,S Pasta penne serveras med krämig paprikasås,632.41,26.57,17.57,84.49,13.63,0.71,415.86
skola,Dagens lunch,2025-02-04,6,Tisdag,Fiskgratäng serveras med potatismos,S Fiskgratäng serveras med potatismos S,121.9,2.75,2.23,21.11,2.59,0.79,144.81
skola,Vegetarisk lunch,2025-02-04,6,Tisdag,Morotsbiffar med potatismos,S Morotsbiffar med potatismos,310.95,8.95,5.07,52.33,8.49,3.85,398.81
skola,Dagens lunch,2025-02-05,6,Onsdag,Färsrätt serveras med ris och salsa,S Färsrätt serveras med ris och salsa,293.12,8.79,2.08,56.13,5.71,3.23,294.55
skola,Vegetarisk lunch,2025-02-05,6,Onsdag,Falafelbiff serveras med ris och vitlökssås,S Falafelbiff serveras med ris och vitlökssås,602.29,16.58,28.21,67.28,7.49,1.09,340.75
skola,Dagens lunch,2025-02-06,6,Torsdag,Kebabpytt serveras med kall sås (fsk vanlig pytt),S Kebabpytt serveras med kall sås (fsk vanlig pytt),659.62,15.5,31.44,73.88,9.39,5.11,375.13
skola,Vegetarisk lunch,2025-02-06,6,Torsdag,Grekisk paj med kall sås,S Grekisk paj med kall sås,388.99,24.08,24.6,14.14,8.33,2.93,427.73
skola,Dagens lunch,2025-02-07,6,Fredag,Kycklinggryta serveras med kokt ris,S Kycklinggryta serveras med kokt ris,468.8,27.16,7.87,68.42,5.78,2.13,420.15
skola,Vegetarisk lunch,2025-02-07,6,Fredag,Broccoli och blomkålsgratäng,Broccoli och blomkålsgratäng,260.22,11.56,18.0,12.19,2.42,0.67,227.5
skola,Dagens lunch,2025-02-10,7,Måndag,Stekt falukorv serveras med potatismos och ketchupS,S Stekt falukorv serveras med potatismos och ketchupS,388.94,12.15,22.98,31.76,3.76,2.9,274.81
skola,Vegetarisk lunch,2025-02-10,7,Måndag,Veggiekorv serveras med potatismos och ketchup,S Veggiekorv serveras med potatismos och ketchup S,400.65,17.05,17.68,40.76,4.76,3.6,274.81
skola,Dagens lunch,2025-02-11,7,Tisdag,"Blomkål- och broccolisoppa serveras med bröd, ost och frukt","S Blomkål- och broccolisoppa serveras med bröd, ost och frukt S",336.34,12.96,13.79,36.25,7.45,3.34,486.5
skola,Vegetarisk lunch,2025-02-11,7,Tisdag,"Minestronesoppa (vegetarisk) serveras med bröd, ost och frukt","S Minestronesoppa (vegetarisk) serveras med bröd, ost och frukt S",283.85,10.74,4.82,45.2,7.15,1.8,445.94
skola,Dagens lunch,2025-02-12,7,Onsdag,Kycklinglasagne,S Kycklinglasagne S,392.96,28.36,12.7,38.46,4.86,0.88,333.07
skola,Vegetarisk lunch,2025-02-12,7,Onsdag,Couscouspytt serveras med ajvarsås,S Couscouspytt serveras med ajvarsås,451.8,10.31,24.18,45.37,6.08,0.44,302.6
skola,Dagens lunch,2025-02-13,7,Torsdag,Pankopanerad fisk serveras med potatis och kall örtsås,S Pankopanerad fisk serveras med potatis och kall örtsås,481.79,29.7,27.02,28.69,2.8,1.67,345.47
skola,Vegetarisk lunch,2025-02-13,7,Torsdag,Grönsaksbiff serveras med potatis och kall örtsås,S Grönsaksbiff serveras med potatis och kall örtsås,464.29,9.21,22.5,50.63,7.18,0.96,323.17
skola,Dagens lunch,2025-02-14,7,Fredag,Mexikansk köttfärsgryta serveras med ris och nachos,Mexikansk köttfärsgryta serveras med ris och nachos,540.73,22.15,15.74,71.68,10.59,3.55,433.13
skola,Vegetarisk lunch,2025-02-14,7,Fredag,Mexikansk gryta med ris och nachos  (veg),S Mexikansk gryta med ris och nachos  (veg),529.13,29.5,9.69,74.63,10.59,4.26,433.13
skola,Dagens lunch,2025-02-24,9,Måndag,Het korvgryta med ris,S Het korvgryta med ris S,454.33,19.49,16.16,56.52,3.11,1.62,387.23
skola,Vegetarisk lunch,2025-02-24,9,Måndag,Kikärtsgryta serveras med ris,S Kikärtsgryta serveras med ris,599.83,14.25,28.14,66.86,11.16,1.41,456.31
skola,Vegetarisk lunch,2025-02-25,9,Tisdag,Broccolibiffar serveras med potatis och kall sås,S Broccolibiffar serveras med potatis och kall sås,283.76,12.6,1.65,48.37,11.18,1.87,362.61
skola,Dagens lunch,2025-02-26,9,Onsdag,Frasig Quornburgare serveras med potatismos och dressing,S Frasig Quornburgare serveras med potatismos och dressing,483.44,16.89,26.14,40.3,2.76,1.83,344.95
skola,Dagens lunch,2025-02-27,9,Torsdag,"Kött- och grönsakssoppa serveras med bröd,ost och frukt","S Kött- och grönsakssoppa serveras med bröd,ost och frukt S",308.54,18.6,7.9,36.81,6.92,2.42,466.8
skola,Vegetarisk lunch,2025-02-27,9,Torsdag,"Morotssoppa serveras med bröd, ost och frukt","S Morotssoppa serveras med bröd, ost och frukt",493.89,12.06,28.58,42.99,8.9,1.45,412.52
skola,Dagens lunch,2025-02-28,9,Fredag,"Köttbullar serveras med potatis,brunsås och lingon","S Köttbullar serveras med potatis,brunsås och lingon",355.48,20.71,14.34,33.97,3.2,3.15,343.4
skola,Vegetarisk lunch,2025-02-28,9,Fredag,"Bouletter serveras med potatis, brunsås och lingon","S Bouletter serveras med potatis, brunsås och lingon",364.41,15.85,12.72,42.81,6.95,2.83,352.4
skola,Dagens lunch,2025-03-03,10,Måndag,Lasagnettegratäng med skinka,S Lasagnettegratäng med skinka,370.85,22.21,8.99,47.54,4.1,1.32,236.22
skola,Vegetarisk lunch,2025-03-03,10,Måndag,Grönsaksgratäng med currytäcke och kokt potatis,S Grönsaksgratäng med currytäcke och kokt potatis,195.88,6.49,3.89,30.15,6.44,0.95,287.1
skola,Dagens lunch,2025-03-04,10,Tisdag,"Falafel serveras med bröd, ris och kall sås","S Falafel serveras med bröd, ris och kall sås",893.46,26.34,26.36,129.74,13.67,3.83,399.88
skola,Dagens lunch,2025-03-05,10,Onsdag,Fiskpanetter serveras med potatis och stuvad spenat,S Fiskpanetter serveras med potatis och stuvad spenat,376.33,22.29,11.7,44.2,3.24,2.91,362.95
skola,Vegetarisk lunch,2025-03-05,10,Onsdag,Grönsakslasagne med spenat,S Grönsakslasagne med spenat,296.04,12.89,4.27,48.8,3.95,0.88,279.22
skola,Dagens lunch,2025-03-06,10,Torsdag,Kycklingwok med nudlar och kall currysås,S Kycklingwok med nudlar och kall currysås,480.21,21.06,25.36,39.98,4.18,0.79,297.89
skola,Vegetarisk lunch,2025-03-06,10,Torsdag,Grönsakswok med nudlar och kall currysås,S Grönsakswok med nudlar och kall currysås,570.86,17.1,25.67,63.31,8.97,0.58,388.92
skola,Dagens lunch,2025-03-07,10,Fredag,Svensk moussaka (potatis och köttfärs),S Svensk moussaka (potatis och köttfärs),403.47,21.94,22.65,26.42,3.45,2.02,389.47
skola,Vegetarisk lunch,2025-03-07,10,Fredag,Moussaka veggie,S Moussaka veggie,378.75,18.82,12.08,44.42,8.05,1.54,383.51
skola,Dagens lunch,2025-03-10,11,Måndag,"Mustig tomatgryta serveras med ris, bröd och ost","S Mustig tomatgryta serveras med ris, bröd och ost",549.1,21.55,12.62,80.62,11.73,3.08,515.8
skola,Dagens lunch,2025-03-11,11,Tisdag,Fiskgratäng Bordelaise serveras med potatismos,S Fiskgratäng Bordelaise serveras med potatismos,401.26,28.43,19.7,25.83,3.23,1.57,259.96
skola,Vegetarisk lunch,2025-03-11,11,Tisdag,Chilikryddad ost-och morotsbiff serveras med potatismos,S Chilikryddad ost-och morotsbiff serveras med potatismos,618.03,35.09,33.84,40.16,6.54,2.28,407.01
skola,Dagens lunch,2025-03-12,11,Onsdag,Rotfruktspytt med kyckling serveras med mangosås,S Rotfruktspytt med kyckling serveras med mangosås,78.61,11.77,2.41,2.3,0.04,0.14,333.84
skola,Vegetarisk lunch,2025-03-12,11,Onsdag,Vegetariska vårrullar med kokt ris och soja,S Vegetariska vårrullar med kokt ris och soja,379.06,10.54,6.9,65.33,2.52,2.77,291.75
skola,Dagens lunch,2025-03-13,11,Torsdag,"Gulaschsoppa på nötfärs serveras med bröd,ost och frukt","S Gulaschsoppa på nötfärs serveras med bröd,ost och frukt",345.2,17.57,11.5,37.97,9.15,0.6,479.0
skola,Vegetarisk lunch,2025-03-13,11,Torsdag,"Lins- och rotsakssoppa serveras med bröd, ost och frukt","S Lins- och rotsakssoppa serveras med bröd, ost och frukt",369.44,18.48,5.08,55.4,12.64,1.4,572.1
skola,Dagens lunch,2025-03-14,11,Fredag,Lasagne al forno,S Lasagne al forno,405.91,21.78,23.63,25.51,2.47,3.04,313.62
skola,Vegetarisk lunch,2025-03-14,11,Fredag,Grönsakslasagne,S Grönsakslasagne S,310.61,13.37,13.93,30.34,5.12,2.29,357.47
skola,Dagens lunch,2025-03-17,12,Måndag,Spaghetti serveras med het sås (tomat och bönor),S Spaghetti serveras med het sås (tomat och bönor),441.96,15.79,9.72,66.99,10.33,2.73,467.82
skola,Vegetarisk lunch,2025-03-17,12,Måndag,Pasta serveras med grönsaksgratäng,S Pasta serveras med grönsaksgratäng,642.0,28.09,16.85,85.27,17.16,2.33,626.18
skola,Dagens lunch,2025-03-18,12,Tisdag,"Chilipanna med ris, cheezydip och nachos","S Chilipanna med ris, cheezydip och nachos",490.61,17.33,14.1,68.69,8.6,3.2,419.87
skola,Vegetarisk lunch,2025-03-18,12,Tisdag,Falafelbiff serveras med ris och vitlökssås,S Falafelbiff serveras med ris och vitlökssås,602.29,16.58,28.21,67.28,7.49,1.09,340.75
skola,Dagens lunch,2025-03-19,12,Onsdag,Pankofisk  serveras med potatismos,S Pankofisk  serveras med potatismos,393.35,28.24,19.24,25.42,2.59,1.5,292.11
skola,Dagens lunch,2025-03-20,12,Torsdag,"Blomkålsoppa med smak av curry serveras med bröd, ost och frukt","S Blomkålsoppa med smak av curry serveras med bröd, ost och frukt",312.65,11.58,13.53,32.77,6.6,3.34,481.6
skola,Vegetarisk lunch,2025-03-20,12,Torsdag,"Mustig rotfruktsoppa serveras med bröd, ost och frukt","S Mustig rotfruktsoppa serveras med bröd, ost och frukt",364.19,20.82,12.3,38.81,6.69,4.89,492.83
skola,Dagens lunch,2025-03-21,12,Fredag,Kalkonschnitzel serveras med potatis och sås,S Kalkonschnitzel serveras med potatis och sås,464.43,21.57,20.8,45.94,2.89,1.95,367.4
skola,Vegetarisk lunch,2025-03-21,12,Fredag,Vegetarisk schnitzel serveras med potatis och sås,S Vegetarisk schnitzel serveras med potatis och sås,454.07,30.31,17.69,40.72,4.45,3.61,372.5
skola,Dagens lunch,2025-03-24,13,Måndag,Wienerkorv serveras med makaroner och ketchup,S Wienerkorv serveras med makaroner och ketchup,552.94,18.43,25.86,59.5,3.97,3.5,295.76
skola,Vegetarisk lunch,2025-03-24,13,Måndag,"Veggiekorv serveras med makaroner, ketchup","Veggiekorv serveras med makaroner, ketchup S",545.29,22.63,18.16,69.7,4.97,3.8,295.76
skola,Dagens lunch,2025-03-25,13,Tisdag,Sprödbakad torsk serveras med potatis och remouladsås,S Sprödbakad torsk serveras med potatis och remouladsås S,461.86,19.96,22.61,42.85,3.49,2.2,310.38
skola,Vegetarisk lunch,2025-03-25,13,Tisdag,Frittatagratäng,S Frittatagratäng,511.62,23.14,22.44,50.62,6.86,0.61,358.6
skola,Dagens lunch,2025-03-26,13,Onsdag,Nasi Goreng (veg) serveras med kall sås,S Nasi Goreng (veg) serveras med kall sås,433.12,15.36,17.71,50.59,3.73,2.59,347.71
skola,Dagens lunch,2025-03-27,13,Torsdag,"Hamburgare med bröd, dressing fsk mos","S Hamburgare med bröd, dressing fsk mos",782.66,25.06,43.85,69.06,6.58,4.01,374.56
skola,Vegetarisk lunch,2025-03-27,13,Torsdag,"Veg. burgare med bröd, mos och dressing","S Veg. burgare med bröd, mos och dressing",551.09,21.68,25.51,53.05,11.32,3.32,324.56
skola,Dagens lunch,2025-03-28,13,Fredag,Kycklingwok med nudlar och kall currysås,S Kycklingwok med nudlar och kall currysås,480.21,21.06,25.36,39.98,4.18,0.79,297.89
skola,Vegetarisk lunch,2025-03-28,13,Fredag,Grönsakswok med nudlar och kall currysås,S Grönsakswok med nudlar och kall currysås,570.86,17.1,25.67,63.31,8.97,0.58,388.92
skola,Dagens lunch,2025-03-31,14,Måndag,Pasta serveras med baconsås (tomat),S Pasta serveras med baconsås (tomat),550.13,17.77,30.64,47.85,6.62,3.48,371.25
skola,Vegetarisk lunch,2025-03-31,14,Måndag,Tiktok pasta,S Tiktok pasta,679.16,25.59,39.17,52.13,8.78,2.14,384.45
skola,Vegetarisk lunch,2025-04-01,14,Tisdag,Örtagårdskryddad morotsbiff serveras med tillbehör,S Örtagårdskryddad morotsbiff serveras med tillbehör,655.6,36.23,32.57,51.06,6.54,2.38,416.19
skola,Dagens lunch,2025-04-02,14,Onsdag,Kalops med kokt potatis och rödbetor,S Kalops med kokt potatis och rödbetor,281.76,20.55,7.44,30.54,4.32,3.33,382.05
skola,Dagens lunch,2025-04-03,14,Torsdag,Soppbuffé,S Soppbuffé,113.98,6.26,4.15,12.05,1.58,0.41,40.0
skola,Vegetarisk lunch,2025-04-03,14,Torsdag,Soppbuffé,S Soppbuffé,113.98,6.26,4.15,12.05,1.58,0.41,40.0
skola,Dagens lunch,2025-04-04,14,Fredag,Chili con Carne serveras med ris S  #,S Chili con Carne serveras med ris S  #,397.48,19.01,11.67,50.99,5.16,3.33,333.88
skola,Vegetarisk lunch,2025-04-04,14,Fredag,Chili sin Carne serveras med ris,S Chili sin Carne serveras med ris S,371.86,9.63,10.61,55.62,6.53,1.68,353.25
skola,Dagens lunch,2025-04-07,15,Måndag,Pytt i panna serveras med rödbetor,S Pytt i panna serveras med rödbetor  S,612.62,14.02,26.44,74.7,9.38,4.96,340.0
skola,Vegetarisk lunch,2025-04-07,15,Måndag,"Grönsakspytt med linser, serveras med rödbetor","S Grönsakspytt med linser, serveras med rödbetor",192.69,12.72,0.44,31.05,5.88,0.16,290.0
skola,Dagens lunch,2025-04-08,15,Tisdag,"Pannbiff serveras med kokt potatis ,brunsås och lingon","S Pannbiff serveras med kokt potatis ,brunsås och lingon",434.54,18.97,18.5,46.01,3.49,3.75,372.4
skola,Dagens lunch,2025-04-09,15,Onsdag,Fiskpanetter serveras med potatis och citronsås,S Fiskpanetter serveras med potatis och citronsås,407.39,23.17,11.64,51.26,2.86,1.59,371.02
skola,Vegetarisk lunch,2025-04-09,15,Onsdag,Grönsaksbiff serveras med potatis och dragonsås,S Grönsaksbiff serveras med potatis och dragonsås,460.61,9.17,21.06,52.81,7.53,1.39,357.29
skola,Dagens lunch,2025-04-10,15,Torsdag,"Pastabuffé med olika såser samt pastasorter, FSK 1sås,1 pasta","S Pastabuffé med olika såser samt pastasorter, FSK 1sås,1 pasta",638.65,26.94,22.72,74.53,13.35,2.02,448.15
skola,Vegetarisk lunch,2025-04-10,15,Torsdag,Indisk vegofärsrätt serveras med pasta,S Indisk vegofärsrätt serveras med pasta,725.76,39.33,29.87,68.99,11.35,1.24,441.98
skola,Dagens lunch,2025-04-11,15,Fredag,"Stekt kyckling serveras med potatis, brunsås och gelé","S Stekt kyckling serveras med potatis, brunsås och gelé",372.43,28.19,9.49,41.25,3.22,3.27,344.15
skola,Vegetarisk lunch,2025-04-11,15,Fredag,"Quornfilé med potatis, brunsås och gelé","S Quornfilé med potatis, brunsås och gelé",352.58,18.53,9.89,42.96,7.84,2.38,354.25
skola,Dagens lunch,2025-04-16,16,Onsdag,Påskbuffé,S Påskbuffé,541.6,31.83,30.95,32.54,2.98,3.54,399.85
skola,Vegetarisk lunch,2025-04-22,17,Tisdag,Vegetarisk Stroganoff med bulgur,S Vegetarisk Stroganoff med bulgur,469.04,22.01,19.36,48.92,4.98,4.01,364.51
skola,Dagens lunch,2025-04-23,17,Onsdag,"Cowboysoppa serveras med bröd, ost och frukt","S Cowboysoppa serveras med bröd, ost och frukt",419.4,20.02,17.15,41.84,8.41,3.07,502.86
skola,Vegetarisk lunch,2025-04-23,17,Onsdag,"Minestronesoppa (vegetarisk) serveras med bröd, ost och frukt","S Minestronesoppa (vegetarisk) serveras med bröd, ost och frukt S",283.85,10.74,4.82,45.2,7.15,1.8,445.94
skola,Dagens lunch,2025-04-24,17,Torsdag,Panerad fisk serveras med potatis och dillmajonnäs,S Panerad fisk serveras med potatis och dillmajonnäs,1051.55,20.57,87.96,45.21,3.4,2.89,383.51
skola,Vegetarisk lunch,2025-04-24,17,Torsdag,Broccolimedaljonger serveras med potatis och örtsås,S Broccolimedaljonger serveras med potatis och örtsås S,497.16,10.81,26.8,50.78,5.2,0.96,318.17
skola,Dagens lunch,2025-04-25,17,Fredag,Tikka Masala serveras med ris,S Tikka Masala serveras med ris,536.69,30.79,18.46,58.89,4.08,3.04,490.15
skola,Vegetarisk lunch,2025-04-25,17,Fredag,Vegetarisk Tikka Masala serveras med ris,S Vegetarisk Tikka Masala serveras med ris,606.77,33.74,21.58,66.55,3.6,3.51,496.75
skola,Dagens lunch,2025-04-28,18,Måndag,Ugnstekt falukorv serveras med potatismos och ketchup,S Ugnstekt falukorv serveras med potatismos och ketchup,388.94,12.15,22.98,31.76,3.76,2.9,274.81
skola,Vegetarisk lunch,2025-04-28,18,Måndag,Vegkorv med tacosmak serveras med potatismos,S Vegkorv med tacosmak serveras med potatismos,440.7,19.83,22.7,37.31,3.91,3.52,292.81
skola,Dagens lunch,2025-04-29,18,Tisdag,Spaghetti med köttfärssås,S Spaghetti med köttfärssås  S,451.51,19.11,13.83,59.72,4.66,3.57,320.26
skola,Vegetarisk lunch,2025-04-29,18,Tisdag,Spaghetti med vegetarisk färssås,S Spaghetti med vegetarisk färssås,408.15,17.38,10.2,57.44,7.28,3.37,360.21
skola,Dagens lunch,2025-04-30,18,Onsdag,Fiskgratäng med curry och kokt potatis,S Fiskgratäng med curry och kokt potatis,345.76,27.36,9.66,34.58,4.36,1.24,350.5
skola,Dagens lunch,2025-05-05,19,Måndag,Pastagratäng med skinka,S Pastagratäng med skinka,541.97,26.23,15.5,71.4,4.42,3.15,400.81
skola,Vegetarisk lunch,2025-05-05,19,Måndag,Pastagratäng med heta grönsaker och sweet chilisås,S Pastagratäng med heta grönsaker och sweet chilisås,516.38,11.81,24.79,59.35,4.23,1.41,249.04
skola,Dagens lunch,2025-05-06,19,Tisdag,Tacos med tillbehör,S Tacos med tillbehör,744.56,30.74,27.58,89.94,5.16,4.54,376.5
skola,Vegetarisk lunch,2025-05-06,19,Tisdag,Vegetarisk tacos med tillbehör,S Vegetarisk tacos med tillbehör,271.4,12.3,14.34,20.79,5.4,2.1,103.0
skola,Dagens lunch,2025-05-07,19,Onsdag,Frasig Quornburgare serveras med potatismos och dressing,S Frasig Quornburgare serveras med potatismos och dressing,483.44,16.89,26.14,40.3,2.76,1.83,344.95
skola,Vegetarisk lunch,2025-05-07,19,Onsdag,Broccolibiff serveras med potatismos,S Broccolibiff serveras med potatismos,244.24,9.71,3.24,39.42,8.26,1.51,301.02
skola,Dagens lunch,2025-05-08,19,Torsdag,Panerad fisk serveras med kokt potatis och varm dillsås,S Panerad fisk serveras med kokt potatis och varm dillsås,427.64,23.15,15.79,47.16,2.98,1.56,368.64
skola,Dagens lunch,2025-05-09,19,Fredag,Thaigryta med kyckling och äggnudlar,S Thaigryta med kyckling och äggnudlar,540.15,28.96,21.72,54.32,5.05,0.82,404.05
skola,Vegetarisk lunch,2025-05-09,19,Fredag,Choladesgryta serveras med nudlar,S Choladesgryta serveras med nudlar,657.83,28.22,32.39,60.6,5.39,2.12,421.8
skola,Dagens lunch,2025-05-12,20,Måndag,Pasta penne serveras med krämig paprikasås,S Pasta penne serveras med krämig paprikasås,632.41,26.57,17.57,84.49,13.63,0.71,415.86
skola,Dagens lunch,2025-05-13,20,Tisdag,Kycklingfile serveras med ris och currysås,S Kycklingfile serveras med ris och currysås,422.58,32.53,9.5,49.46,2.81,3.1,357.92
skola,Vegetarisk lunch,2025-05-13,20,Tisdag,Quornfilé serveras med currysås och ris,S Quornfilé serveras med currysås och ris,440.85,23.07,13.86,51.67,7.59,2.43,373.86
skola,Dagens lunch,2025-05-14,20,Onsdag,Cornflakesfisk med kokt potatis och gräslökssås,S Cornflakesfisk med kokt potatis och gräslökssås,452.21,28.66,16.3,44.92,4.62,2.72,395.22
skola,Vegetarisk lunch,2025-05-14,20,Onsdag,Falafel serveras med tomatsås och kokt potatis,S Falafel serveras med tomatsås och kokt potatis,466.81,14.37,17.87,55.42,13.04,3.22,378.83
skola,Dagens lunch,2025-05-15,20,Torsdag,"Het färssoppa serveras med bröd,ost och frukt","S Het färssoppa serveras med bröd,ost och frukt",360.41,14.99,12.53,41.83,9.53,3.27,478.24
skola,Vegetarisk lunch,2025-05-15,20,Torsdag,"Indisk vegosoppa severas med bröd, ost och frukt","S Indisk vegosoppa severas med bröd, ost och frukt",618.29,20.95,30.51,58.89,12.46,1.53,479.92
skola,Dagens lunch,2025-05-16,20,Fredag,"Schnitzel serveras med kokt potatis, inlagd gurka och brunsås","S Schnitzel serveras med kokt potatis, inlagd gurka och brunsås",406.53,24.72,14.75,40.94,4.63,3.98,372.4
skola,Vegetarisk lunch,2025-05-16,20,Fredag,"Vegetarisk schnitzel med kokt potatis, inlagd gurka och brunsås","S Vegetarisk schnitzel med kokt potatis, inlagd gurka och brunsås",346.99,10.29,17.24,59.88,3.43,2.42,377.5
skola,Dagens lunch,2025-05-19,21,Måndag,Wienerkorv serveras med kokt pasta och ketchup,S Wienerkorv serveras med kokt pasta och ketchup,548.05,17.8,26.45,56.07,7.33,2.61,297.35
skola,Vegetarisk lunch,2025-05-19,21,Måndag,"Veggiekorv serveras med pasta, ketchup","Veggiekorv serveras med pasta, ketchup S",540.4,22.0,18.75,66.27,8.33,2.91,297.35
skola,Dagens lunch,2025-05-20,21,Tisdag,"Köttbullar serveras med potatis,brunsås och lingon","S Köttbullar serveras med potatis,brunsås och lingon",355.48,20.71,14.34,33.97,3.2,3.15,343.4
skola,Vegetarisk lunch,2025-05-20,21,Tisdag,Bouletter i tomatsås med kokt potatis,S Bouletter i tomatsås med kokt potatis,335.18,15.61,12.74,34.59,9.54,2.67,339.83
skola,Dagens lunch,2025-05-21,21,Onsdag,Sprödbakad fisk serveras med potatis och citron-och dillsås,S Sprödbakad fisk serveras med potatis och citron-och dillsås,489.7,20.36,25.06,43.95,3.56,1.96,338.84
skola,Vegetarisk lunch,2025-05-21,21,Onsdag,Currygryta med kokos och kokt potatis,S Currygryta med kokos och kokt potatis,684.92,24.24,46.48,40.13,6.17,2.97,504.85
