menu_type,alternativ,datum,vecka,veckodag,ratt,ratt_orig,energi_kcal,protein_g,fett_g,kolhydrater_g,kostfibrer_g,salt_g,vikt_g
ao,A-kost alt 1,2025-05-10,19,Lördag,"Stekt spättafilé med potatis*, remouladesås och kokta grönsaker","Stekt spättafilé med potatis*, remouladesås och kokta grönsaker",633.09,26.96,46.52,25.92,4.05,3.9,340.59
ao,A-kost alt 2,2025-05-10,19,Lördag,Svensk moussaka (inkl. potatis) med tzatziki och sallad ÄO,Svensk moussaka (inkl. potatis) med tzatziki och sallad ÄO,538.57,30.58,30.88,32.62,4.45,3.08,538.24
ao,Grov Paté alt 1,2025-05-10,19,Lördag,"Stekt spättafilé med potatis*, remouladesås och kokta grönsaker","Stekt spättafilé med potatis*, remouladesås och kokta grönsaker",633.09,26.96,46.52,25.92,4.05,3.9,340.59
ao,Grov Paté alt 2,2025-05-10,19,Lördag,Svensk moussaka med tzatziki och grönsaker,Svensk moussaka med tzatziki och grönsaker,516.11,29.26,28.52,32.91,5.8,2.87,563.24
ao,Timbal alt 1,2025-05-10,19,Lördag,"Panerad torsktimbal med potatismos, tartarsås och grönsakstimbal","Panerad torsktimbal med potatismos, tartarsås och grönsakstimbal",559.22,18.03,37.77,36.39,3.56,2.32,379.18
ao,Timbal alt 2,2025-05-10,19,Lördag,"Kött- och potatismosgratäng timb, tzatziki slät och grönsaktimbal","Kött- och potatismosgratäng timb, tzatziki slät och grönsaktimbal",347.78,16.67,18.25,29.6,2.28,1.89,303.27
ao,A-kost alt 1,2025-05-11,19,Söndag,"Skinkstek med potatis*, gräddsås och pressgurka","Skinkstek med potatis*, gräddsås och pressgurka",386.68,33.62,20.55,16.63,0.21,6.5,395.8
ao,A-kost alt 2,2025-05-11,19,Söndag,Svensk moussaka (inkl. potatis) med tzatziki och sallad ÄO,Svensk moussaka (inkl. potatis) med tzatziki och sallad ÄO,538.57,30.58,30.88,32.62,4.45,3.08,538.24
ao,Grov Paté alt 1,2025-05-11,19,Söndag,"Skinkpaté med potatis*, gräddsås och pressgurka","Skinkpaté med potatis*, gräddsås och pressgurka",355.21,13.27,23.91,21.83,0.37,4.82,363.3
ao,Grov Paté alt 2,2025-05-11,19,Söndag,Svensk moussaka med tzatziki och grönsaker,Svensk moussaka med tzatziki och grönsaker,516.11,29.26,28.52,32.91,5.8,2.87,563.24
ao,Timbal alt 1,2025-05-11,19,Söndag,"Skinktimbal stekt, gräddsås, potatismos, gurka","Skinktimbal stekt, gräddsås, potatismos, gurka",372.46,12.55,20.55,32.99,2.49,3.25,477.15
ao,Timbal alt 2,2025-05-11,19,Söndag,"Kött- och potatismosgratäng timb, tzatziki slät och grönsaktimbal","Kött- och potatismosgratäng timb, tzatziki slät och grönsaktimbal",347.78,16.67,18.25,29.6,2.28,1.89,303.27
ao,A-kost alt 1,2025-05-12,20,Måndag,Kassler Hawaii med ris* och grönsaker,Kassler Hawaii med ris* och grönsaker,541.97,32.83,30.14,32.47,5.3,6.25,467.75
ao,A-kost alt 2,2025-05-12,20,Måndag,Kycklingsoppa,Kycklingsoppa,187.59,20.36,6.61,10.59,1.91,0.97,366.52
ao,Grov Paté alt 1,2025-05-12,20,Måndag,Kassler Hawaii paté med ris* och grönsaker,Kassler Hawaii paté med ris* och grönsaker,409.92,6.96,27.39,31.85,5.3,0.88,467.75
ao,Grov Paté alt 2,2025-05-12,20,Måndag,Kycklingsoppa paté,Kycklingsoppa paté,230.44,14.73,12.69,13.29,2.29,2.25,366.52
ao,Timbal alt 1,2025-05-12,20,Måndag,"Kasslergratäng med ananas timbal, ris och grönsak","Kasslergratäng med ananas timbal, ris och grönsak",760.32,20.01,61.18,33.16,2.26,2.28,260.0
ao,Timbal alt 2,2025-05-12,20,Måndag,Kycklingsoppa timbal,Kycklingsoppa timbal,378.35,15.15,25.51,21.5,2.34,1.12,412.27
ao,A-kost alt 1,2025-05-13,20,Tisdag,"Pankopanerad fiskfilé med dillmajonnäs, potatis* och grönsaker","Pankopanerad fiskfilé med dillmajonnäs, potatis* och grönsaker",945.89,26.45,88.17,13.53,2.05,1.94,342.51
ao,A-kost alt 2,2025-05-13,20,Tisdag,Kycklingsoppa,Kycklingsoppa,187.59,20.36,6.61,10.59,1.91,0.97,366.52
ao,Grov Paté alt 1,2025-05-13,20,Tisdag,"Pankopanerad fiskfilé med dillmajonnäs, potatis* och grönsaker","Pankopanerad fiskfilé med dillmajonnäs, potatis* och grönsaker",945.89,26.45,88.17,13.53,2.05,1.94,342.51
ao,Grov Paté alt 2,2025-05-13,20,Tisdag,Kycklingsoppa paté,Kycklingsoppa paté,230.44,14.73,12.69,13.29,2.29,2.25,366.52
ao,Timbal alt 1,2025-05-13,20,Tisdag,"Panerad torsktimbal, dillmajonnäs, palsternacksmos och grönsakstimbal","Panerad torsktimbal, dillmajonnäs, palsternacksmos och grönsakstimbal",1118.65,20.13,94.7,48.12,7.41,2.23,485.42
ao,Timbal alt 2,2025-05-13,20,Tisdag,Kycklingsoppa timbal,Kycklingsoppa timbal,378.35,15.15,25.51,21.5,2.34,1.12,412.27
ao,A-kost alt 1,2025-05-14,20,Onsdag,Kålpudding med potatis* och gräddsås,Kålpudding med potatis* och gräddsås,371.91,16.14,25.18,22.71,5.12,2.19,393.03
ao,A-kost alt 2,2025-05-14,20,Onsdag,Dillkött med kokt potatis* och grönsaker,Dillkött med kokt potatis* och grönsaker,366.17,29.39,22.2,11.04,2.89,15.77,308.16
ao,Grov Paté alt 1,2025-05-14,20,Onsdag,Kålpudding med potatis* och gräddsås,Kålpudding med potatis* och gräddsås,371.91,16.14,25.18,22.71,5.12,2.19,393.03
ao,Grov Paté alt 2,2025-05-14,20,Onsdag,"Dillkött, grov paté med potatis* och grönsaker","Dillkött, grov paté med potatis* och grönsaker",128.01,3.39,6.68,12.66,2.36,1.29,295.0
ao,Timbal alt 1,2025-05-14,20,Onsdag,"Kålpudding timbal, gräddsås, potatismos och grönsakstimbal","Kålpudding timbal, gräddsås, potatismos och grönsakstimbal",488.58,18.97,26.58,43.52,3.8,3.54,501.8
ao,Timbal alt 2,2025-05-14,20,Onsdag,Dillkött timbal med mos och grönsak,Dillkött timbal med mos och grönsak,366.51,17.07,14.46,41.54,3.38,1.59,355.25
ao,A-kost alt 1,2025-05-15,20,Torsdag,Skaldjurssoppa,Skaldjurssoppa,196.78,11.82,9.26,14.53,3.96,1.76,319.69
ao,A-kost alt 2,2025-05-15,20,Torsdag,Dillkött med kokt potatis* och grönsaker,Dillkött med kokt potatis* och grönsaker,366.17,29.39,22.2,11.04,2.89,15.77,308.16
ao,Grov Paté alt 1,2025-05-15,20,Torsdag,Skaldjurssoppa,Skaldjurssoppa,196.78,11.82,9.26,14.53,3.96,1.76,319.69
ao,Grov Paté alt 2,2025-05-15,20,Torsdag,"Dillkött, grov paté med potatis* och grönsaker","Dillkött, grov paté med potatis* och grönsaker",128.01,3.39,6.68,12.66,2.36,1.29,295.0
ao,Timbal alt 1,2025-05-15,20,Torsdag,Skaldjurssoppa slät,Skaldjurssoppa slät,292.54,18.0,18.9,13.05,,2.93,270.0
ao,Timbal alt 2,2025-05-15,20,Torsdag,Dillkött timbal med mos och grönsak,Dillkött timbal med mos och grönsak,366.51,17.07,14.46,41.54,3.38,1.59,355.25
ao,A-kost alt 1,2025-05-16,20,Fredag,"Köttfärslimpa med kokt potatis*, gräddsås och grönsaker","Köttfärslimpa med kokt potatis*, gräddsås och grönsaker",224.83,6.85,46.92,15.06,2.89,3.05,380.4
ao,A-kost alt 2,2025-05-16,20,Fredag,Korv Stroganoff med ris* och kokta grönsaker,Korv Stroganoff med ris* och kokta grönsaker,365.79,13.19,27.97,14.63,2.91,2.34,287.51
ao,Grov Paté alt 1,2025-05-16,20,Fredag,"Köttfärslimpa med kokt potatis*, gräddsås och grönsaker","Köttfärslimpa med kokt potatis*, gräddsås och grönsaker",224.83,6.85,46.92,15.06,2.89,3.05,380.4
ao,Grov Paté alt 2,2025-05-16,20,Fredag,Korv Stroganoff med ris* och kokta grönsaker,Korv Stroganoff med ris* och kokta grönsaker,365.79,13.19,27.97,14.63,2.91,2.34,287.51
ao,Timbal alt 1,2025-05-16,20,Fredag,"Järptimbal, gräddsås, potatismos och grönsak","Järptimbal, gräddsås, potatismos och grönsak",329.23,9.05,17.65,32.18,3.13,3.26,485.55
ao,Timbal alt 2,2025-05-16,20,Fredag,"Korv Stroganoff timbal, ris och grönsakstimbal","Korv Stroganoff timbal, ris och grönsakstimbal",614.38,20.77,42.77,37.17,1.94,4.07,390.0
ao,A-kost alt 1,2025-05-17,20,Lördag,"Kokt lax med potatis*, hollandaisesås och kokta grönsaker","Kokt lax med potatis*, hollandaisesås och kokta grönsaker",537.28,26.24,42.86,11.63,1.95,0.7,297.7
ao,A-kost alt 2,2025-05-17,20,Lördag,Korv Stroganoff med ris* och kokta grönsaker,Korv Stroganoff med ris* och kokta grönsaker,365.79,13.19,27.97,14.63,2.91,2.34,287.51
ao,Grov Paté alt 1,2025-05-17,20,Lördag,"Kokt lax med potatis*, hollandaisesås och kokta grönsaker","Kokt lax med potatis*, hollandaisesås och kokta grönsaker",537.28,26.24,42.86,11.63,1.95,0.7,297.7
ao,Grov Paté alt 2,2025-05-17,20,Lördag,Korv Stroganoff med ris* och kokta grönsaker,Korv Stroganoff med ris* och kokta grönsaker,365.79,13.19,27.97,14.63,2.91,2.34,287.51
ao,Timbal alt 1,2025-05-17,20,Lördag,"Kokt laxtimbal med potatismos, hollandaisesås och grönsaker","Kokt laxtimbal med potatismos, hollandaisesås och grönsaker",558.56,13.24,38.99,38.08,3.17,1.66,420.25
ao,Timbal alt 2,2025-05-17,20,Lördag,Korv Stroganoff timbal med ristimbal och grönsaker,Korv Stroganoff timbal med ristimbal och grönsaker,614.38,20.77,42.77,37.17,1.94,4.07,390.0
ao,A-kost alt 1,2025-05-18,20,Söndag,"Stekt kyckling med potatisgratäng*, rödvinssås och grönsaker","Stekt kyckling med potatisgratäng*, rödvinssås och grönsaker",417.59,27.63,30.26,4.18,2.11,5.44,256.8
ao,A-kost alt 2,2025-05-18,20,Söndag,Korv Stroganoff med ris* och kokta grönsaker,Korv Stroganoff med ris* och kokta grönsaker,365.79,13.19,27.97,14.63,2.91,2.34,287.51
ao,Grov Paté alt 1,2025-05-18,20,Söndag,"Stekt kycklingpaté med potatisgratäng*, rödvinssås och grönsaker","Stekt kycklingpaté med potatisgratäng*, rödvinssås och grönsaker",402.38,13.28,33.95,6.57,2.35,5.62,247.55
ao,Grov Paté alt 2,2025-05-18,20,Söndag,Korv Stroganoff med ris* och kokta grönsaker,Korv Stroganoff med ris* och kokta grönsaker,365.79,13.19,27.97,14.63,2.91,2.34,287.51
ao,Timbal alt 1,2025-05-18,20,Söndag,"Stekt kycklingtimbal med rödvinssås, potatisgratäng och grönsaker","Stekt kycklingtimbal med rödvinssås, potatisgratäng och grönsaker",740.12,20.92,51.28,43.79,4.19,4.62,534.95
ao,Timbal alt 2,2025-05-18,20,Söndag,"Korv Stroganoff timbal, ris och grönsakstimbal","Korv Stroganoff timbal, ris och grönsakstimbal",614.38,20.77,42.77,37.17,1.94,4.07,390.0
ao,A-kost alt 1,2025-05-19,21,Måndag,"Chili con carne, ris* och grönsaker ÄO","Chili con carne, ris* och grönsaker ÄO",395.21,23.93,18.72,27.62,10.69,2.36,371.79
ao,A-kost alt 2,2025-05-19,21,Måndag,Pytt i panna med stekt ägg ÄO,Pytt i panna med stekt ägg ÄO,566.74,17.96,27.34,58.47,7.25,4.22,305.0
ao,Grov Paté alt 1,2025-05-19,21,Måndag,"Chili con carne, ris* och grönsaker ÄO","Chili con carne, ris* och grönsaker ÄO",395.21,23.93,18.72,27.62,10.69,2.36,371.79
ao,Grov Paté alt 2,2025-05-19,21,Måndag,"Gräddstuvad pytt i panna paté, stekt ägg","Gräddstuvad pytt i panna paté, stekt ägg",757.75,19.03,47.74,60.0,7.25,4.27,356.0
ao,Timbal alt 1,2025-05-19,21,Måndag,Chili con carne timbal med ris och grönsaker ÄO,Chili con carne timbal med ris och grönsaker ÄO,505.53,16.05,32.77,36.87,3.25,1.11,360.0
ao,Timbal alt 2,2025-05-19,21,Måndag,"Pytt i panna timbal, äggkräm, rödbetsgelé","Pytt i panna timbal, äggkräm, rödbetsgelé",618.3,32.82,33.96,59.27,5.26,3.05,709.1
ao,A-kost alt 1,2025-05-20,21,Tisdag,"Kokt torsk med senapsås,  potatis* och kokta grönsaker","Kokt torsk med senapsås,  potatis* och kokta grönsaker",286.78,25.88,11.48,18.65,2.24,0.9,295.76
ao,A-kost alt 2,2025-05-20,21,Tisdag,Pytt i panna med stekt ägg ÄO,Pytt i panna med stekt ägg ÄO,566.74,17.96,27.34,58.47,7.25,4.22,305.0
ao,Grov Paté alt 1,2025-05-20,21,Tisdag,"Kokt torsk med senapsås,  potatis* och kokta grönsaker","Kokt torsk med senapsås,  potatis* och kokta grönsaker",286.78,25.88,11.48,18.65,2.24,0.9,295.76
ao,Grov Paté alt 2,2025-05-20,21,Tisdag,"Gräddstuvad pytt i panna paté, stekt ägg","Gräddstuvad pytt i panna paté, stekt ägg",757.75,19.03,47.74,60.0,7.25,4.27,356.0
ao,Timbal alt 1,2025-05-20,21,Tisdag,"Kokt torsktimbal med senapssås, ärtgrönt mos och grönsaker","Kokt torsktimbal med senapssås, ärtgrönt mos och grönsaker",628.38,25.85,31.67,56.81,7.76,1.72,501.8
ao,Timbal alt 2,2025-05-20,21,Tisdag,"Pytt i panna timbal, äggkräm, rödbetsgelé","Pytt i panna timbal, äggkräm, rödbetsgelé",618.3,32.82,33.96,59.27,5.26,3.05,709.1
ao,A-kost alt 1,2025-05-21,21,Onsdag,"Kycklinggryta med aprikoser, ris* och kokta grönsaker","Kycklinggryta med aprikoser, ris* och kokta grönsaker",361.63,27.44,14.38,27.87,5.21,1.24,326.0
ao,A-kost alt 2,2025-05-21,21,Onsdag,Sparrissoppa m. korvslantar,Sparrissoppa m. korvslantar,264.49,10.14,18.53,14.13,1.71,1.41,300.8
ao,Grov Paté alt 1,2025-05-21,21,Onsdag,"Kycklinggryta med aprikoser paté, ris* och kokta grönsaker","Kycklinggryta med aprikoser paté, ris* och kokta grönsaker",394.66,15.54,22.14,30.75,5.61,2.56,306.0
ao,Grov Paté alt 2,2025-05-21,21,Onsdag,Sparrissoppa m. korvslantar,Sparrissoppa m. korvslantar,264.49,10.14,18.53,14.13,1.71,1.41,300.8
ao,Timbal alt 1,2025-05-21,21,Onsdag,"Kycklinggryta timbal med aprikoser, solskensmos och grönsaker","Kycklinggryta timbal med aprikoser, solskensmos och grönsaker",645.2,19.39,32.23,65.75,9.45,1.58,511.0
ao,Timbal alt 2,2025-05-21,21,Onsdag,"Sparrissoppa slät, korvtimbal","Sparrissoppa slät, korvtimbal",307.3,13.65,21.74,14.47,1.49,2.21,305.0
ao,A-kost alt 1,2025-05-22,21,Torsdag,Lasagne med sallad,Lasagne med sallad,487.58,26.81,20.84,45.72,4.51,2.59,358.0
ao,A-kost alt 2,2025-05-22,21,Torsdag,Sparrissoppa m. korvslantar,Sparrissoppa m. korvslantar,264.49,10.14,18.53,14.13,1.71,1.41,300.8
ao,Grov Paté alt 1,2025-05-22,21,Torsdag,Lasagne med grönsaker,Lasagne med grönsaker,465.11,25.49,18.48,46.01,5.86,2.37,383.0
ao,Grov Paté alt 2,2025-05-22,21,Torsdag,Sparrissoppa m. korvslantar,Sparrissoppa m. korvslantar,264.49,10.14,18.53,14.13,1.71,1.41,300.8
ao,Timbal alt 1,2025-05-22,21,Torsdag,Lasagnetimbal med grönsakstimbal,Lasagnetimbal med grönsakstimbal,593.61,27.82,46.72,18.04,0.91,1.7,340.0
ao,Timbal alt 2,2025-05-22,21,Torsdag,"Sparrissoppa slät, korvtimbal","Sparrissoppa slät, korvtimbal",307.3,13.65,21.74,14.47,1.49,2.21,305.0
ao,A-kost alt 1,2025-05-23,21,Fredag,"Schnitzel med brunsås, stekt potatis* och grönsaker","Schnitzel med brunsås, stekt potatis* och grönsaker",513.21,28.88,21.21,48.31,6.19,3.79,352.02
ao,A-kost alt 2,2025-05-23,21,Fredag,Pannbiff med stekt potatis* grönpepparsås och grönsaker,Pannbiff med stekt potatis* grönpepparsås och grönsaker,464.47,26.14,31.32,18.59,2.96,3.35,338.55
ao,Grov Paté alt 1,2025-05-23,21,Fredag,"Schnitzel paté, sås, potatis*, kokta grönsaker","Schnitzel paté, sås, potatis*, kokta grönsaker",158.62,5.28,10.3,10.31,2.19,2.17,287.02
ao,Grov Paté alt 2,2025-05-23,21,Fredag,Pannbiff med stekt potatis* grönpepparsås och grönsaker,Pannbiff med stekt potatis* grönpepparsås och grönsaker,464.47,26.14,31.32,18.59,2.96,3.35,338.55
ao,Timbal alt 1,2025-05-23,21,Fredag,"Schnitzel timbal, sås, stekt potatis, ärttimbal","Schnitzel timbal, sås, stekt potatis, ärttimbal",536.13,21.12,30.27,42.8,4.41,3.92,461.82
ao,Timbal alt 2,2025-05-23,21,Fredag,"Färstimbal, grönpepparsås, stekt potatis och grönsak","Färstimbal, grönpepparsås, stekt potatis och grönsak",385.5,11.6,19.99,38.05,4.16,1.81,461.71
ao,A-kost alt 1,2025-05-24,21,Lördag,"Citronfisk med kapris, kokt potatis* och grönsaker","Citronfisk med kapris, kokt potatis* och grönsaker",312.71,26.31,18.37,9.47,2.49,0.69,264.95
ao,A-kost alt 2,2025-05-24,21,Lördag,"Pannbiff, grönpepparsås, potatis*, grönsaker","Pannbiff, grönpepparsås, potatis*, grönsaker",464.47,26.14,31.32,18.59,2.96,3.35,338.55
ao,Grov Paté alt 1,2025-05-24,21,Lördag,"Citronfisk med kapris, kokt potatis* och grönsaker","Citronfisk med kapris, kokt potatis* och grönsaker",312.71,26.31,18.37,9.47,2.49,0.69,264.95
ao,Grov Paté alt 2,2025-05-24,21,Lördag,"Pannbiff, grönpepparsås, potatis*, grönsaker","Pannbiff, grönpepparsås, potatis*, grönsaker",464.47,26.14,31.32,18.59,2.96,3.35,338.55
ao,Timbal alt 1,2025-05-24,21,Lördag,"Kokt torsktimbal med citronsås, potatismos och grönsakstimbal","Kokt torsktimbal med citronsås, potatismos och grönsakstimbal",497.36,22.05,24.84,45.44,3.31,2.52,444.75
ao,Timbal alt 2,2025-05-24,21,Lördag,"Färstimbal, grönpepparsås, morotsmos, grönsaker","Färstimbal, grönpepparsås, morotsmos, grönsaker",323.03,9.18,16.26,33.24,5.14,1.83,486.91
ao,A-kost alt 1,2025-05-25,21,Söndag,"Slottsstek med gräddsås, potatis* och grönsaker","Slottsstek med gräddsås, potatis* och grönsaker",361.44,34.09,18.21,13.9,2.8,3.59,327.41
ao,A-kost alt 2,2025-05-25,21,Söndag,"Pannbiff, grönpepparsås, potatis*, grönsaker","Pannbiff, grönpepparsås, potatis*, grönsaker",464.47,26.14,31.32,18.59,2.96,3.35,338.55
ao,Grov Paté alt 1,2025-05-25,21,Söndag,"Slottsstek paté med gräddsås, potatis* och grönsaker","Slottsstek paté med gräddsås, potatis* och grönsaker",373.34,11.22,26.33,22.28,2.11,2.71,295.3
ao,Grov Paté alt 2,2025-05-25,21,Söndag,"Pannbiff, grönpepparsås, potatis*, grönsaker","Pannbiff, grönpepparsås, potatis*, grönsaker",464.47,26.14,31.32,18.59,2.96,3.35,338.55
ao,Timbal alt 1,2025-05-25,21,Söndag,"Slottsstek timbal med gräddsås, blomkålsmos och grönsaker","Slottsstek timbal med gräddsås, blomkålsmos och grönsaker",532.69,22.22,30.3,42.02,4.89,4.35,530.3
ao,Timbal alt 2,2025-05-25,21,Söndag,"Färstimbal, grönpepparsås, blomkålsmos, grönsaker","Färstimbal, grönpepparsås, blomkålsmos, grönsaker",317.71,10.24,16.02,31.2,4.66,2.15,486.91
ao,A-kost alt 1,2025-05-26,22,Måndag,Spagetti* med köttfärssås och sallad,Spagetti* med köttfärssås och sallad,289.11,19.31,18.11,11.26,2.52,2.68,256.7
ao,A-kost alt 2,2025-05-26,22,Måndag,"Stekt prinskorv, stuvad spenat, stekt potatis*","Stekt prinskorv, stuvad spenat, stekt potatis*",285.97,13.02,19.76,13.67,1.49,5.31,300.59
ao,Grov Paté alt 1,2025-05-26,22,Måndag,Spagetti* med köttfärssås och grönsaker,Spagetti* med köttfärssås och grönsaker,266.64,17.99,15.75,11.54,3.87,2.47,281.7
ao,Grov Paté alt 2,2025-05-26,22,Måndag,"Stekt prinskorv, stuvad spenat, stekt potatis*","Stekt prinskorv, stuvad spenat, stekt potatis*",285.97,13.02,19.76,13.67,1.49,5.31,300.59
ao,Timbal alt 1,2025-05-26,22,Måndag,Spagetti timbal med köttfärssås och grönsakstimbal,Spagetti timbal med köttfärssås och grönsakstimbal,382.64,23.66,22.98,21.13,2.35,1.57,389.5
ao,Timbal alt 2,2025-05-26,22,Måndag,Korvtimbal med brynt potatis och stuvad spenat slät,Korvtimbal med brynt potatis och stuvad spenat slät,447.35,20.42,19.71,44.45,4.89,4.83,515.39
ao,A-kost alt 1,2025-05-27,22,Tisdag,Fiskgratäng med kaviar och dill serveras med kokt potatis* och grönsaker,Fiskgratäng med kaviar och dill serveras med kokt potatis* och grönsaker,279.19,31.37,10.43,13.51,2.36,1.16,293.88
ao,A-kost alt 2,2025-05-27,22,Tisdag,"Stekt prinskorv, stuvad spenat, stekt potatis*","Stekt prinskorv, stuvad spenat, stekt potatis*",285.97,13.02,19.76,13.67,1.49,5.31,300.59
ao,Grov Paté alt 1,2025-05-27,22,Tisdag,Fiskgratäng med kaviar och dill serveras med kokt potatis* och grönsaker,Fiskgratäng med kaviar och dill serveras med kokt potatis* och grönsaker,279.19,31.37,10.43,13.51,2.36,1.16,293.88
ao,Grov Paté alt 2,2025-05-27,22,Tisdag,"Stekt prinskorv, stuvad spenat, stekt potatis*","Stekt prinskorv, stuvad spenat, stekt potatis*",285.97,13.02,19.76,13.67,1.49,5.31,300.59
ao,Timbal alt 1,2025-05-27,22,Tisdag,"Fiskgratäng med kaviar och dill timbal, palsternacksmos, grönsak","Fiskgratäng med kaviar och dill timbal, palsternacksmos, grönsak",699.6,23.03,45.62,48.8,7.23,2.81,545.0
ao,Timbal alt 2,2025-05-27,22,Tisdag,Korvtimbal med brynt potatis och stuvad spenat slät,Korvtimbal med brynt potatis och stuvad spenat slät,447.35,20.42,19.71,44.45,4.89,4.83,515.39
ao,A-kost alt 1,2025-05-28,22,Onsdag,"Fläskköttgryta med dijonsenap, potatis* och grönsaker","Fläskköttgryta med dijonsenap, potatis* och grönsaker",608.54,21.05,51.12,15.54,4.06,0.48,347.0
ao,A-kost alt 2,2025-05-28,22,Onsdag,Kyckling i citron- och basilikasås med ris* och grönsaker,Kyckling i citron- och basilikasås med ris* och grönsaker,272.82,5.42,21.73,12.78,3.4,0.66,216.61
ao,Grov Paté alt 1,2025-05-28,22,Onsdag,"Fläskköttgryta med dijonsenap paté, potatis*, grönsaker","Fläskköttgryta med dijonsenap paté, potatis*, grönsaker",626.33,14.41,53.76,20.74,4.22,1.28,347.0
ao,Grov Paté alt 2,2025-05-28,22,Onsdag,Kyckling i citron- och basilikasås paté med ris* och grönsaker,Kyckling i citron- och basilikasås paté med ris* och grönsaker,401.62,15.91,30.13,15.48,3.78,2.08,291.54
ao,Timbal alt 1,2025-05-28,22,Onsdag,"Fläskköttgryta m dijonsenap timb, palsternacksmos, grönsaker","Fläskköttgryta m dijonsenap timb, palsternacksmos, grönsaker",903.73,21.48,64.83,56.96,9.82,1.63,573.0
ao,Timbal alt 2,2025-05-28,22,Onsdag,Kyckling i citron- och basilikasås timbal med ris och grönsaker,Kyckling i citron- och basilikasås timbal med ris och grönsaker,744.11,20.15,58.16,35.53,2.98,1.61,366.54
ao,A-kost alt 1,2025-05-29,22,Torsdag,Läcker laxsoppa med crème fraiche,Läcker laxsoppa med crème fraiche,491.44,17.59,43.2,8.68,1.42,1.21,379.75
ao,A-kost alt 2,2025-05-29,22,Torsdag,Kyckling i citron- och basilikasås med ris* och grönsaker,Kyckling i citron- och basilikasås med ris* och grönsaker,272.82,5.42,21.73,12.78,3.4,0.66,216.61
ao,Grov Paté alt 1,2025-05-29,22,Torsdag,Läcker laxsoppa med crème fraiche,Läcker laxsoppa med crème fraiche,491.44,17.59,43.2,8.68,1.42,1.21,379.75
ao,Grov Paté alt 2,2025-05-29,22,Torsdag,Kyckling i citron- och basilikasås paté med ris* och grönsaker,Kyckling i citron- och basilikasås paté med ris* och grönsaker,401.62,15.91,30.13,15.48,3.78,2.08,291.54
ao,Timbal alt 1,2025-05-29,22,Torsdag,Läcker laxsoppa med crème fraiche timbal,Läcker laxsoppa med crème fraiche timbal,558.19,17.49,47.5,15.78,2.32,1.49,409.3
ao,Timbal alt 2,2025-05-29,22,Torsdag,Kyckling i citron- och basilikasås timbal med ris och grönsaker,Kyckling i citron- och basilikasås timbal med ris och grönsaker,744.11,20.15,58.16,35.53,2.98,1.61,366.54
ao,A-kost alt 1,2025-05-30,22,Fredag,Kåldolmar med potatis* och gräddsås,Kåldolmar med potatis* och gräddsås,330.8,13.81,23.52,14.79,3.39,3.66,310.3
ao,A-kost alt 2,2025-05-30,22,Fredag,Pepparrotskött med kokt potatis* och grönsaker,Pepparrotskött med kokt potatis* och grönsaker,282.98,24.52,14.89,11.29,3.11,0.34,353.9
ao,Grov Paté alt 1,2025-05-30,22,Fredag,Kåldolmar med potatis* och gräddsås,Kåldolmar med potatis* och gräddsås,330.8,13.81,23.52,14.79,3.39,3.66,310.3
ao,Grov Paté alt 2,2025-05-30,22,Fredag,"Pepparrotskött paté med kokt potatis*, grönsaker","Pepparrotskött paté med kokt potatis*, grönsaker",124.02,3.11,6.7,11.61,2.58,1.0,298.6
ao,Timbal alt 1,2025-05-30,22,Fredag,Kåldolmar/pudding timbal med potatismos och gräddsås,Kåldolmar/pudding timbal med potatismos och gräddsås,425.48,16.17,22.58,39.52,3.0,3.12,461.8
ao,Timbal alt 2,2025-05-30,22,Fredag,"Pepparrotskött timbal, ärtgröntmos och grönsak","Pepparrotskött timbal, ärtgröntmos och grönsak",355.89,11.28,13.44,43.42,7.83,1.58,450.0
ao,A-kost alt 1,2025-05-31,22,Lördag,"Fiskfärsbiff med med kall dillsås , potatis* och grönsaker","Fiskfärsbiff med med kall dillsås , potatis* och grönsaker",867.23,25.09,77.36,18.54,2.89,1.97,375.16
ao,A-kost alt 2,2025-05-31,22,Lördag,Pepparrotskött med kokt potatis* och grönsaker,Pepparrotskött med kokt potatis* och grönsaker,282.98,24.52,14.89,11.29,3.11,0.34,353.9
ao,Grov Paté alt 1,2025-05-31,22,Lördag,"Fiskfärsbiff med med kall dillsås , potatis* och grönsaker","Fiskfärsbiff med med kall dillsås , potatis* och grönsaker",867.23,25.09,77.36,18.54,2.89,1.97,375.16
ao,Grov Paté alt 2,2025-05-31,22,Lördag,"Pepparrotskött paté med kokt potatis*, grönsaker","Pepparrotskött paté med kokt potatis*, grönsaker",124.02,3.11,6.7,11.61,2.58,1.0,298.6
ao,Timbal alt 1,2025-05-31,22,Lördag,"Panerad torsktimbal med potatismos, dillmajonnäs slät och grönsaker","Panerad torsktimbal med potatismos, dillmajonnäs slät och grönsaker",1053.72,19.13,91.87,39.31,3.39,3.05,450.67
ao,Timbal alt 2,2025-05-31,22,Lördag,"Pepparrotskött timbal, ärtgröntmos och grönsak","Pepparrotskött timbal, ärtgröntmos och grönsak",355.89,11.28,13.44,43.42,7.83,1.58,450.0
ao,A-kost alt 1,2025-06-01,22,Söndag,"Örtkryddad kycklingfilé, klyftpotatis*, dragonsås och grönsaker","Örtkryddad kycklingfilé, klyftpotatis*, dragonsås och grönsaker",220.72,22.71,8.32,12.42,2.35,1.36,248.22
ao,A-kost alt 2,2025-06-01,22,Söndag,Pepparrotskött med kokt potatis* och grönsaker,Pepparrotskött med kokt potatis* och grönsaker,282.98,24.52,14.89,11.29,3.11,0.34,353.9
ao,Grov Paté alt 1,2025-06-01,22,Söndag,"Örtkryddad kycklingpaté, klyftpotatis*, dragonsås och grönsaker","Örtkryddad kycklingpaté, klyftpotatis*, dragonsås och grönsaker",272.03,14.86,16.29,15.3,2.75,2.71,245.72
ao,Grov Paté alt 2,2025-06-01,22,Söndag,"Pepparrotskött paté med kokt potatis*, grönsaker","Pepparrotskött paté med kokt potatis*, grönsaker",124.02,3.11,6.7,11.61,2.58,1.0,298.6
ao,Timbal alt 1,2025-06-01,22,Söndag,"Örtkryddad kycklingtimbal, klyftpotatis, dragonsås, grönsaker","Örtkryddad kycklingtimbal, klyftpotatis, dragonsås, grönsaker",610.51,23.01,33.57,52.3,4.7,2.48,482.47
ao,Timbal alt 2,2025-06-01,22,Söndag,"Pepparrotskött timbal, ärtgröntmos och grönsak","Pepparrotskött timbal, ärtgröntmos och grönsak",355.89,11.28,13.44,43.42,7.83,1.58,450.0
ao,A-kost alt 1,2025-06-02,23,Måndag,"Järpar med katrinplommon, brunsås, potatis* och kokta grönsaker","Järpar med katrinplommon, brunsås, potatis* och kokta grönsaker",473.58,26.38,25.89,31.74,4.54,4.55,376.67
ao,A-kost alt 2,2025-06-02,23,Måndag,Högsbosoppa (morotssoppa),Högsbosoppa (morotssoppa),235.4,3.15,21.27,7.73,1.6,1.08,300.65
ao,Grov Paté alt 1,2025-06-02,23,Måndag,"Järpar med katrinplommon, brunsås, potatis* och kokta grönsaker","Järpar med katrinplommon, brunsås, potatis* och kokta grönsaker",473.58,26.38,25.89,31.74,4.54,4.55,376.67
ao,Grov Paté alt 2,2025-06-02,23,Måndag,Högsbosoppa (morotssoppa),Högsbosoppa (morotssoppa),235.4,3.15,21.27,7.73,1.6,1.08,300.65
